VoiceMed,https://www.crunchbase.com/organization/voicemed,,"Artificial Intelligence (AI), Health Care","Luxembourg, Luxembourg, Luxembourg",AI and vocal biomarkers for providiny health check directly on the smartphone. Lung and cardiorespiratory health.,"77,897","European Union (EU), Europe, Middle East, and Africa (EMEA)",,,Active,2020-12-01,month,,,,,For Profit,https://www.voicemed.io,,https://www.linkedin.com/company/42952189/admin/,contact@voicemed.io,,"VoiceMed is at the forefront of healthcare innovation, leveraging cutting-edge AI technology to develop voice-based biomarkers for providing health checks 100% through software. Our current products focus on lung and cardiorespiratory health, useful for both screening and monitoring. Our mission is to make healthcare more accessible, accurate, and non-invasive through the power of voice analysis.",,,,,,,,,,,,"Artificial Intelligence (AI), Data and Analytics, Health Care, Science and Engineering, Software",3,"Arianna Arienzo, Ayana Martins, Fulvio Cordella",1-10,2,Seed,2024-07-25,225000,EUR,244156,Pre-Seed,225000,EUR,244156,Pre-Seed,475000,EUR,529443,475000,EUR,529443,"EIT Digital, Padda Health",,2,,,,,,,,,,,,,,Private,,,,,,,,,,,,,0,9,0,2,,Scientific and electric apparatus and instruments
Trainect,https://www.crunchbase.com/organization/trainect,,"Fitness, Health Care, Wellness","Roma, Lazio, Italy",Corporate Wellness Platform 360°,"79,265","European Union (EU), Europe, Middle East, and Africa (EMEA)",00185,Less than $1M,Active,2020-04-15,day,,,,,For Profit,https://www.trainect.it,https://www.facebook.com/TRAINECT/,https://www.linkedin.com/company/trainect/,alberto.ronco@trainect.it,+39 3471414454,"Trainect is the Italian startup that provides companies and their people with a simple and intuitive platform to improve and monitor their physical and mental well-being, increase team building and productivity, assigning a wellness score and rewarding improvements with charity. We believe in an idea of well-being that is circular, responsible and shared.  Our goal is to bring this idea into companies to encourage well-being that is taking care of yourself, the people around you and the surrounding environment. We want to bring well-being within reach of the company.",,,,,,,,,,,,"Health Care, Sports",4,"Alberto Ronco, Federico Anagni, Loris Nanni, Simone Proietti Timperi",11-50,3,Seed,2023-02-01,150000,EUR,165191,Seed,150000,EUR,165191,Seed,325000,EUR,371316,703000,EUR,803810,"Lazio Innova, Startupbootcamp, Digital Magics, Invitalia",1,4,,,,,,,,,,,,,,Private,,,,,,,,,,,,,1.1,6,,,,
Letsell,https://www.crunchbase.com/organization/Letsell,,"E-Commerce, E-Commerce Platforms, Fashion, Internet, Lifestyle, Shopping","Torino, Piemonte, Italy",Letsell is the first online service that allow everyone to opening and manage an online store,"81,104","European Union (EU), Europe, Middle East, and Africa (EMEA)",20153,Less than $1M,Active,2017-05-01,day,,,,,For Profit,http://www.letsell.com/home/,https://www.facebook.com/Letsell.ecommerce,https://www.linkedin.com/company/25078298/,info@letsell.com,,"Letsell is the first online service that allow everyone to opening and manage an online store. With Letsell you can manage an already-complete fashion e-commerce and  start an innovative business venture without having to open  your own business. Available to all Letsell users, there is a fashion catalog that includes thousands of men's and women's clothing items - including shoes, handbags, underwear, accessories and baby clothes. Every week there are new arrivals. Users of the service will only be concerned with the promotion of the site among their contacts, while the whole sale, warehouse, delivery, and resale process is managed by Letsell. The service, which includes a subscription starting at €29 per month, allows people to start earning immediately with an average profit rate of 35% on each sale. Easy to manage from any device such as a PC or tablet, Letsell is the ideal tool for those who want to integrate their monthly revenue and for those who need a business that can be managed in full autonomy and from anywhere.",,,,,,,,,,,,"Clothing and Apparel, Commerce and Shopping, Community and Lifestyle, Design, Internet Services",3,"Carlo Tafuri, Luca Ferrero, Michele Contrini",1-10,5,Seed,2021-06-18,3000000,EUR,3559048,Seed,3000000,EUR,3559048,Seed,5220000,EUR,6083231,5220000,EUR,6083231,LIFTT,1,1,,,,,,,,,,,,,,Private,,,,,,,,,,,,,0.3,9,,,,
Coderblock,https://www.crunchbase.com/organization/coderblock,,"Artificial Intelligence (AI), Augmented Reality, Information Services, Information Technology, SaaS, Software, Virtual Reality","Palermo, Sicilia, Italy",Coderblock is an AI-powered immersive training platform that enhances learning through GenAI and VR making engaging training for enterprises,"82,162","European Union (EU), Europe, Middle East, and Africa (EMEA)",,Less than $1M,Active,2016-05-01,month,,,,,For Profit,https://www.coderblock.com/en,https://www.facebook.com/Coderblock.Platform,https://www.linkedin.com/company/11068379/,info@coderblock.com,786-376-1404,"Coderblock is an AI-powered immersive training platform that leverages Generative AI to create intelligent virtual agents and data-driven learning experiences. By integrating AI-driven simulations, our platform enables realistic, interactive training scenarios where users can develop soft skills through adaptive role-playing and real-time feedback. Our AI agents analyze user interactions, providing personalized insights and enhancing professional growth. With a data-driven approach, Coderblock transforms traditional training into measurable, scalable, and engaging experiences for enterprises and professionals.",,,,,,,,,,,,"Artificial Intelligence (AI), Data and Analytics, Hardware, Information Technology, Science and Engineering, Software",1,Danilo Costa,11-50,2,,2023-02-02,1000000,EUR,1090465,Venture - Series Unknown,1000000,EUR,1090465,Venture - Series Unknown,1000000,EUR,1090465,1000000,EUR,1090465,"Deloitte Consulting, ADM Media Consulting, TechItalia:Lab",3,3,,,,,,,,,,,,,,Private,,,,,,,,,,,,,-0.3,4,,,,
3Brain,https://www.crunchbase.com/organization/3-brain,,"Biotechnology, Health Care, Life Science, Neuroscience","Wadenswil, Zurich, Switzerland",3Brain is the world's first company that sells large scale high resolution MEA recording platforms and CMOS-MEA biochips.,"82,651","Europe, Middle East, and Africa (EMEA)",8820,$1M to $10M,Active,2011-02-01,day,,,,,For Profit,https://3brain.com,,https://linkedin.com/company/3brain,info@3brain.com,41813227086,"3Brain is the world’s first company to connect cells with sophisticated silicon chips in cell culture plates. Stemming from our passion for technology and scientific progress, our co-founders have worked for more than 15 years on CMOS-powered cell-electronic interfaces with the aim of boosting research in major fields like neuroscience, ophthalmology and cardiology. After being the first to introduce CMOS-based HD-MEA (high-density microelectrode array) to overcome passive MEA limitations, we are now setting up the next standard by introducing the CorePlate™ technology, a multiwell device for advanced cell-based analysis backed by per well logical processing cores. Our unfaltering research and development are aimed at improving in vitro cell-based screening outputs and thus raising the potential of finding new treatments for brain disease.",,,,,,,,,,,,"Biotechnology, Health Care, Science and Engineering",2,"Alessandro Maccione, Mauro Gandolfo",11-50,2,,2018-02-20,,,,Grant,,,,,,,,1700000,CHF,1747946,Eurostars,,1,,,,,,,,,,,,,,Private,,,,,,,,,,,,,-0.6,4,2,2,Testing,Scientific and electric apparatus and instruments
Surface Technology International,https://www.crunchbase.com/organization/surface-technology-international,,"Electronics, Industrial Manufacturing, Mechanical Engineering, Product Design, Supply Chain Management","Hook, Hampshire, United Kingdom","Surface Technology International is an electronics manufacturer that provides integrated design, engineering, and manufacturing support.","83,582","Europe, Middle East, and Africa (EMEA)",RG27 9HX,$500M to $1B,Active,1989-01-01,year,,,,,For Profit,https://www.sti-limited.com,https://www.facebook.com/pages/Surface-Technology-International-Philippines/1553692098224240,https://www.linkedin.com/company/sti-ltd/,,+44 1256 768070,"Surface Technology International specializes in electronics design and manufacturing solutions in printed circuit board assembly (PCBA) and box-build manufacturing. They offer manufacturing services, from concept design, prototyping, and production through to complete box-build, including thermal vibration and full product testing. The company serves the aerospace, defense, and security sectors.",,,,,,,,,,,,"Consumer Electronics, Design, Hardware, Manufacturing, Science and Engineering, Transportation",1,Simon Best,501-1000,1,,2024-07-03,11300000,GBP,14404612,Debt Financing,,,,,,,,11300000,GBP,14404612,Cynergy Business Finance,1,1,,,,,,,,,,,,,,Private,,,,,,,,,,,,,-0.7,15,,,,
Elaisian,https://www.crunchbase.com/organization/elaisian,,"Agriculture, AgTech, Farming, Sensor","Roma, Lazio, Italy","Elaisian is a precision farming system that prevents diseases for olive groves, vineyards and almond trees.","84,332","European Union (EU), Europe, Middle East, and Africa (EMEA)",00177,$1M to $10M,Active,2016-11-01,month,,,,,For Profit,https://www.elaisian.com/,https://www.facebook.com/elaisian,https://www.linkedin.com/company/10974771,info@elaisian.com,,"Elaisian is a precision farming service that focuses on the preservation of olive trees.  By a system of algorithms based on a database of agronomic studies, the company is able to prevent diseases and to optimize cultivation processes such as irrigation and fertilization. The goal is to improve olive tree's life and the producer's work. ",,,,,,,,,,,,"Agriculture and Farming, Hardware",3,"Damiano Angelici, Gabriele Allegrini, Giovanni Di Mambro",11-50,8,Seed,2023-12-07,600000,EUR,647388,Convertible Note,800000,EUR,899247,Seed,2205000,EUR,2538651,2940000,EUR,3341911,"CDP Venture Capital, Lazio Innova, Regione Puglia, Startupbootcamp FoodTech Rome, InnoVaventures",1,6,,,,,,,,,,,,,,Private,,,,,,,,,,,,,-0.4,4,0,1,,Machines and machine tools
AIO,https://www.crunchbase.com/organization/aio,,Manufacturing,"Tainan, T'ai-wan, Taiwan",AIO pushes the limits to create high quality enclosure solutions and all-in-one PCs with cutting edge designs.,"86,009",Asia-Pacific (APAC),,Less than $1M,Active,1999-01-01,year,,,,,For Profit,http://www.aio-group.com,,,sales@aio-group.com.cn,86-769-88342105,"A leading PC developer since 1999, AIO pushes the limits to create high quality enclosure solutions and all-in-one PCs with cutting edge designs. With 3 offices situated in 3 strategic locations, i.e. Taiwan (financial headquarter & sales), The Netherlands (design centre & sales) and China (manufacturing & sales), AIO takes advantage of local resources and provides fast and efficient service and support locally as well as countries within the region.",,,,,,,,,,,,Manufacturing,,,11-50,1,Seed,2018-07-30,2000000,USD,2000000,Seed,2000000,USD,2000000,Seed,2000000,USD,2000000,2000000,USD,2000000,Remark Holdings,1,1,,,,,,,,,,,,,,Private,,,,,,,,,,,,,3.9,6,,,,
REJOINT,https://www.crunchbase.com/organization/rejoint,,"3D Technology, Artificial Intelligence (AI), Health Care, Machine Learning, Manufacturing, Medical","Bologna, Emilia-Romagna, Italy",Rejoint develops Artificial Intelligence driven 3D printed personalized knee replacements.,"88,087","European Union (EU), Europe, Middle East, and Africa (EMEA)",40138,$1M to $10M,Active,2015-06-30,day,,,,,For Profit,https://www.rejoint.life,,https://www.linkedin.com/company/rejoint,info@rejoint.life,+39 051 0238 555,"Rejoint is a start-up pioneer in new technology and surgical approaches in Total Knee Arthroplasty. It has developed a solution for knee replacement based on the integration of 3D Additive Manufacturing (AM), Artificial Intelligence (AI), and the Internet of Things (IoT), which enables the design of personalized implants and surgical simulation based on unique patient anatomy. The company is led by people with more than 20 years in the orthopedic industry and by previous members of worldwide leading medtech companies like Covidien, Smith&Nephew, Sorin, and Bellco. Rejoint was founded in 2015 and is based in Bologna, Italy.",,,,,,,,,,,,"Artificial Intelligence (AI), Data and Analytics, Hardware, Health Care, Manufacturing, Science and Engineering, Software",2,"Gian Guido Riva, Lorenzo Riva",11-50,3,Early Stage Venture,2019-10-01,2000000,USD,2000000,Series A,2000000,USD,2000000,Series A,3665002,USD,3665002,6665002,USD,6665002,,,,,,,,,,,,,,,,,Private,,,,,,,,,,,,,-0.4,6,3,3,Medical Or Veterinary Science; Hygiene,Medical apparatus and instruments
SurgiQ,https://www.crunchbase.com/organization/surgiq,,"Artificial Intelligence (AI), Health Care, Machine Learning, Scheduling, Software","Genoa, Liguria, Italy","SurgiQ helps hospitals and clinics streamline planning, optimize resources, and make faster decisions.","91,043","European Union (EU), Europe, Middle East, and Africa (EMEA)",16121,Less than $1M,Active,2016-03-31,day,,,,,For Profit,https://www.surgiq.com,,https://www.linkedin.com/company/15156552,learn@surgiq.com,,"SurgiQ is an AI-driven healthcare technology company optimizing hospital operations through intelligent planning and scheduling solutions. With a focus on surgical procedures, chemotherapy, and rehabilitation, SurgiQ helps hospitals streamline workflows, reduce waiting times, and maximize resource efficiency. The company's patented AI technology ensures balanced workloads and optimal patient care while improving hospital financial performance. SurgiQ serves public and private healthcare institutions, offering a scalable, high-impact solution with measurable results. The company is growing 2x YoY and preparing for further international growth.",,,,,,,,,,,,"Artificial Intelligence (AI), Data and Analytics, Health Care, Information Technology, Science and Engineering, Software",3,"Arianna Poggi, Giuseppe Galatà, Ivan Porro",1-10,5,Seed,2023-10-01,170000,USD,170000,Convertible Note,495000,USD,495000,Seed,950000,USD,950000,1180000,USD,1180000,"CDP Venture Capital, Digital Magics, EIT Health, DigitalHealth.London Accelerator, The Birdhouse",4,7,,,,,,,,,,,,,,Private,,,,,,,,,,,,,-0.8,51,0,2,,Scientific and electric apparatus and instruments
Emotiva,https://www.crunchbase.com/organization/emotiva,,"Analytics, Artificial Intelligence (AI), Computer Vision, Information Technology, Machine Learning","Milano, Lombardia, Italy",Emotiva is a deep tech artificial intelligence company specialized in measuring human's attention and affective states.,"91,468","European Union (EU), Europe, Middle East, and Africa (EMEA)",20146,Less than $1M,Active,2017-10-03,day,,,,,For Profit,https://www.emotiva.it,https://www.facebook.com/emotivaitalia/,https://www.linkedin.com/company/emotiva-ai,info@emotiva.it,+39 0287189207,"Emotiva is a deep tech artificial intelligence company specialized in measuring human's attention and affective states. It has developed computer vision and machine learning algorithms to detect and analyze micro facial movements encoded as Action Units (AUs), units of activation of a muscle or muscle groups that configure the expression of an emotion. Considering emotions a value of absolute importance, Emotiva has established the ethical-scientific committee that oversees the development of technology and ethics of artificial intelligence, taking into account the aspects related to privacy and GDPR laws. Emotiva actively collaborates with the PHuSE Lab, the Computer Science department of the University of Milan, and the top Italian Universities in computer vision and robotics fields for R&D activities. Emotiva has developed EmPower, a SaaS platform in media analytics, to analyze emotional responses and measure people's attention levels while watching content. It has made a process that used to be complex and costly, easy and fast. Today it is possible to get insights on unconscious response in just a few clicks. Thanks to EmPower, companies make more accurate decisions and avoid wasting their budget on target segments that are poorly connected emotionally or lack attention.",,,,,,,,,,,,"Artificial Intelligence (AI), Data and Analytics, Hardware, Information Technology, Science and Engineering, Software",3,"Andrea Lori, Andrea Sempi, Lorenzo Corbo",11-50,2,Seed,2021-11-03,610000,EUR,708512,Seed,610000,EUR,708512,Seed,720000,EUR,831651,720000,EUR,831651,LVenture Group,1,1,,,,,,,,,,,,,,Private,,,,,,,,,,,,,-0.5,7,,,,
Jobby,https://www.crunchbase.com/organization/jobby-2,,"Employment, Human Resources, Marketplace, Recruiting, Staffing Agency","Milano, Lombardia, Italy","Jobby is a B2B platform that provides ""work as a service"", where businesses can find, hire and manage temp workers in a matter of seconds.","91,671","European Union (EU), Europe, Middle East, and Africa (EMEA)",,Less than $1M,Active,2016-07-26,day,,,,,For Profit,https://www.jobby.works,https://www.facebook.com/jobbyworks/,https://www.linkedin.com/company/jobby-srl/,amministrazione@jobby.works,+39 3485934766,"Jobby is a B2B platform that provides ""work as a service"", where businesses can find, hire and manage temp workers in a matter of seconds. Jobby wants to make work accessible to everyone. With their technology companies can find vetted workers in a matter of seconds and hire them for temporary jobs and gigs managing every aspect of the process with one single digital tool.",,,,,,,,,,,,"Administrative Services, Commerce and Shopping, Professional Services",1,Andrea Goggi,11-50,3,Seed,2022-02-28,2000000,EUR,2242872,Seed,2000000,EUR,2242872,Seed,3322872,USD,3322872,3322872,USD,3322872,,,,,,,,,,,,,,,,,Private,,,,,,,,,,,,,-0.1,10,,,,
MCES,https://www.crunchbase.com/organization/mces,,"eSports, Gaming, Sports, Video Games","Marseille, Provence-Alpes-Cote d'Azur, France","MCES is a French esports organization bridging ""sport & esport""","91,779","European Union (EU), Europe, Middle East, and Africa (EMEA)",13011,$1M to $10M,Active,2018-01-01,year,,,,,For Profit,https://www.mces.gg/,https://www.facebook.com/MCESofficiel/,https://www.linkedin.com/company/mcesofficiel/,contact@mces.gg,,"MCES is a French esports organization. Their MCES Gaming Center spaces are equipped with a dedicated fiber, many PC gamers and consoles to come practice your passion alone or in groups.With the experience in sports training and esport of their professional team MCES (coaches recognized on the professional esport scene and former sports titled like Yannick Agnel or Guy Demel), thy provide MCES Academy with a high-level approach to training. competitive practice of video games.",,,,,,,,,,,,"Gaming, Sports",3,"Romain Sombret, Sebastien Pinel, Xavier Kern",11-50,2,Early Stage Venture,2020-07-05,2800000,USD,2800000,Series A,2800000,USD,2800000,Series A,4800000,USD,4800000,4800000,USD,4800000,"Turenne Capital, Gilles Mischler",1,2,,,,,,,,,,,,,,Private,,,,,,,,,,,,,2,17,0,2,,Scientific and technological services
Rubber Conversion,https://www.crunchbase.com/organization/rubber-conversion,,"Industrial, Plastics and Rubber Manufacturing, Wholesale","Cerea, Veneto, Italy",Rubber Conversion manufactures light trucks and automobile tires.,"93,221","European Union (EU), Europe, Middle East, and Africa (EMEA)",37053,,Active,2017-01-01,year,,,,,For Profit,https://www.rubberconversion.com,,https://www.linkedin.com/company/rubber-conversion,info@rubberconversion.com,+39 0442 333 259,"Rubber Conversion provides recycling, product sustainability, custom packaging, environmental impact analysis, material tracking, and online document management. Their customers contact them through phone, email, and online applications.",,,,,,,,,,,,"Commerce and Shopping, Manufacturing",1,Carlo Alberto Maggiolo,11-50,1,Early Stage Venture,2022-03-30,2500000,EUR,2790365,Series A,2500000,EUR,2790365,Series A,2500000,EUR,2790365,2500000,EUR,2790365,"LIFTT, CDP Equity",,2,,,,,,,,,,,,,,Private,,,,,,,,,,,,,0.3,11,,,,
Hygge,https://www.crunchbase.com/organization/hygge-3930,,Pet,"Lucca, Toscana, Italy",Hygge is a pet food company.,"93,346","European Union (EU), Europe, Middle East, and Africa (EMEA)",55100,,Active,2020-01-01,year,,,,,For Profit,https://www.hygge-dog.com,,https://www.linkedin.com/company/hygge-dog/,sales@hygge-dog.com,,"Hygge provides a portion of pet food to create the perfect kibble for dogs, giving the right kibble for our dogs is the first step to keeping them healthy and happy for a long time.",,,,,,,,,,,,Community and Lifestyle,4,"Giada Iacopini, Martina Terigi, Nicole Decanini, Samuele Nannini",11-50,3,Seed,2025-04-28,,,,Grant,300000,EUR,321988,Seed,300000,EUR,321988,300000,EUR,321988,"Amazon Sustainability Accelerator, PranaVentures, SocialFare, Emanuele Minetti, Anna De Stefano",2,6,,,,,,,,,,,,,,Private,,,,,,,,,,,,,4.5,9,0,1,,Agricultural products; live animals
Fitwell,https://www.crunchbase.com/organization/fitwell,,"Fitness, Health Care, mHealth","London, England, United Kingdom",Fitwell is a wellness A.I. start-up focused on providing contextual holistic coaching combining fitness and wellness.,"93,419","Europe, Middle East, and Africa (EMEA)",W8 5EH,Less than $1M,Active,2014-01-01,year,,,,,For Profit,https://www.fitwell.co,https://www.facebook.com/fitwellcoachapp,https://www.linkedin.com/company/fitwellcoach,,,Fitwell is an AI powered fit-tech company that helps time starved people be fitter and healthier through a state of the art mobile app and bot. Fitwell has more than 1.6 million members globally and been selected Best of PlayStore and Top Developer by Google; featured among best apps by Apple. The company has been rated as one of the top start-ups by Early Metrics. Fitwell was named among top 10 AI companies in Fitness Tech industry to watch in 2018 by Disruptor Daily.,,,,,,,,,,,,"Health Care, Mobile, Sports",1,Baris Ozaydinli,11-50,5,Seed,2018-05-01,1025000,USD,1025000,Seed,1025000,USD,1025000,Seed,1535000,USD,1535000,1867529,USD,1867529,"Founders Factory, Microsoft Accelerator, Valuta Capital Partners, Microsoft Accelerator London",,4,,,,,,,,,,,,,,Private,,,,,,,,,,,,,0,5,0,1,,"Pharmaceutical, veterinary and sanitary products"
Irreo,https://www.crunchbase.com/organization/irreo,,"AgTech, Farming, Mobile Apps, Sustainability","Rome, Lazio, Italy",Plan irrigation wisely without the need to install any sensor on the field,"93,513","European Union (EU), Europe, Middle East, and Africa (EMEA)",00173,,Active,2019-07-15,day,,,,,For Profit,https://irreo.nodriver.ai/,https://www.facebook.com/irreo.nodriver,https://www.linkedin.com/company/irreo,info@irreo.ai,,"We enable agricultural and ornamental operators to automatize their irrigation system in a smart and efficient way to counter drought problems due to ongoing climate change.  Launched in 2021, Irreo can provide dynamic and optimal irrigation scheduling using different types of satellite data without the need to install any sensors in the field. In addition, through our innovative control system and thanks to our field controllers, our customers can manage irrigation and fertigation directly from their smartphones.",,,,,,,,,,,,"Agriculture and Farming, Apps, Mobile, Software, Sustainability",,,11-50,2,Seed,2022-11-23,850000,EUR,885543,Seed,850000,EUR,885543,Seed,1700000,EUR,1722270,1700000,EUR,1722270,"Primo Capital, Lazio Innova, Digital Magics",1,3,,,,,,,,,,,,,,Private,,,,,,,,,,,,,0.8,7,,,,
Wesii,https://www.crunchbase.com/organization/wesii,,"Renewable Energy, Software","Chiavari, Liguria, Italy",Using top thermographic technology to provide a quick and easy way to track PV plant maintenance.,"93,701","European Union (EU), Europe, Middle East, and Africa (EMEA)",16043,Less than $1M,Active,2016-01-01,year,,,,,For Profit,https://wesii.com/,https://www.facebook.com/WeSiiOfficial,https://www.linkedin.com/company/wesii-s.r.l.,sales@wesii.com,391-495-7045,"WESII S.r.l is a company based on the extensive international experience in the hyper and multispectral aerial inspections and analysis. One of the main focuses of the continuous research and specialization is remote sensing and advanced thermography with the obtainment of II level certify UNI EN 473 of Wesii’s technicians. The company’s core business consists in the provision of high-quality analysis of aerial inspections conducted using drones and remote thermal/multispectral sensor mainly in the photovoltaic industry. WESII offers an innovative technological approach to solve those problems by investing in research and continuous development which lead to providing a series of practices that help O&M companies, asset managers and PV plant owners to speed up the maintenance process and lower its costs.",,,,,,,,,,,,"Energy, Software, Sustainability",,,11-50,2,,2024-03-08,2800000,EUR,3064181,Venture - Series Unknown,2800000,EUR,3064181,Venture - Series Unknown,3025000,EUR,3321234,3025000,EUR,3321234,"Banca Patrimoni Sella & C., DXT Commodities",,2,,,,,,,,,,,,,,Private,,,,,,,,,,,,,-0.2,,,,,
