SMC,https://www.crunchbase.com/organization/smc-e616,,"Architecture, Art, Consulting, Graphic Design, Interior Design","London, England, United Kingdom","SMC is a design studio that provides branding, interior design, artwork, graphic design, and architectural services.","246,351","Europe, Middle East, and Africa (EMEA)",SE1 3GL,$1M to $10M,Active,1988-01-01,year,,,,,For Profit,https://www.smc-design.com,https://www.facebook.com/smcdesignlondon,https://www.linkedin.com/company/smc-design,info@smc-design.com,+44-207-378-1468,,,,,,,,,,,,,"Design, Media and Entertainment, Professional Services, Real Estate",,,101-250,,,,,,,,,,,,,,,,,,,,,,,,,,,,,,,,,,Private,,,,,,,,,,,,,8.4,27,,,,
Doorway,https://www.crunchbase.com/organization/doorway-platform,,"Financial Services, FinTech, Venture Capital","Bologna, Emilia-Romagna, Italy",Doorway provides a platform for Venture capital firms to find the right investment opportunities and also provides consulting for same.,"247,279","European Union (EU), Europe, Middle East, and Africa (EMEA)",40125,,Active,2016-01-01,year,,,,,For Profit,https://www.doorwayplatform.com/,https://www.facebook.com/doorwayplatform/,https://www.linkedin.com/company/doorway-platform/,team@doorwayplatform.com,+39 051 6123833,,"Private Equity Firm, Venture Capital",Seed,10,12,,4,1,,,,,"Financial Services, Lending and Investments",,,11-50,,,,,,,,,,,,,,,,,,,,,,,,,,,,,,,,,,Private,,,,,,,,,,,,,0,9,0,3,,Insurance; financial affairs
Sounder,https://www.crunchbase.com/organization/sounder,,"Consumer, Internet, Internet of Things, Messaging, Social Media, Software, Video","San Francisco, California, United States","Gesture-based voice communication, with patent-pending accessibility controls.","254,701","San Francisco Bay Area, West Coast, Western US",94105,Less than $1M,Active,2011-11-21,day,,,,,For Profit,http://www.sounder.me,,,,,"Gesture-based voice communication, with patent-pending accessibility controls.  Sounder takes the original promise of NexTel, and finally executes it on the smartphone. For consumer and business users. See http://www.engadget.com/2012/05/15/sounder-launches-we-go-hands-on-video/",,,,,,,,,,,,"Information Technology, Internet Services, Media and Entertainment, Messaging and Telecommunications, Other, Software, Video",2,"Michael Fortson, Nancy Broden",1-10,1,Seed,2012-02-23,150000,USD,150000,Seed,150000,USD,150000,Seed,150000,USD,150000,150000,USD,150000,"Kii Capital, Strive Capital",,2,,,,,,,,,,,,,,Private,,,,,,,,,,,,,2.4,12,,,,
Vivace,https://www.crunchbase.com/organization/vivace,,"Industrial, Industrial Engineering, Manufacturing","San Antonio, Texas, United States",Vivace designs and manufactures spaceflight systems and ground support equipment.,"256,389",Southern US,78257,$1M to $10M,Active,2006-01-01,year,,,,,For Profit,https://www.vivace.com,,,info@vivace.com,+1 425 223 3747,"Vivace is a company that creates spaceflight systems and ground support equipment. Vivace provides performance, efficient solutions and delivers them on time through rigorous design, analysis, fabrication, and testing. They design and manufacture integrated spaceflight systems, aerostructures, and components.",,,,,,,,,,,,"Manufacturing, Science and Engineering",,,11-50,1,Private Equity,2024-08-06,,,,Private Equity,,,,Private Equity,,,,,,,Cerberus Capital Management,1,1,,,,,,,,,,,,,,Private,,,,,,,,,,,,,-0.1,12,,,,
Technosens,https://www.crunchbase.com/organization/technosens,,Health Care,"Sathonay-village, Rhone-Alpes, France","Technosens develops a platform for residential care markets that enhances the relationships between residents, and their families.","259,610","European Union (EU), Europe, Middle East, and Africa (EMEA)",69580,,Active,2007-01-01,year,2015-11-20,day,,,For Profit,http://www.technosens.fr/,,https://www.linkedin.com/company/technosens,,+33 4 76 23 02 40,"Technosens develops a platform for residential care markets that enhances the relationships between caregivers, residents, and their families. It focuses on retirement homes, assisted-living residences, and hospitals. The company enables professionals to animate the establishment using a computer or telephone to share the communication made within the establishment with all the families and to benefit from optional services.",,,,,,,,,,,,Health Care,,,,,M&A,,,,,,,,,,,,,,,,,,,,Was Acquired,Technosens acquired by Visiomed,https://www.crunchbase.com/acquisition/visiomed-acquires-technosens--8a803a53,Visiomed,https://www.crunchbase.com/organization/visiomed,2015-11-20,day,,,,Acquisition,,Private,,,,,,,,,,,,,9,,0,5,,Scientific and electric apparatus and instruments
Numex,https://www.crunchbase.com/organization/numex-fc6d,,"3D Technology, Software","Dietikon, Zurich, Switzerland",Numex develops 3D planning technology to improve orthopedic implant surgeries.,"260,253","Europe, Middle East, and Africa (EMEA)",8953,Less than $1M,Active,2018-01-01,year,,,,,For Profit,https://www.numex-solutions.com,,https://www.linkedin.com/company/numex-solutions/,info@numex-solutions.com,+41 525110480,"Numex provides software for the virtual planning of surgeries in the field of orthopedics, including resections, osteotomies, and arthroplasties, as well as an analysis method to examine surgical strategies. They enable surgeons to evaluate surgeries and examine their impacts on patients.",,,,,,,,,,,,"Hardware, Software",3,"Dario Denzler, Dominic Muller, Thorsten Schwenke",11-50,1,,2016-08-09,10000,CHF,10189,Grant,,,,,,,,10000,CHF,10189,Venture Kick,1,1,,,,,,,,,,,,,,Private,,,,,,,,,,,,,0.5,8,,,,
Mashcream,https://www.crunchbase.com/organization/mashcream,,"Consumer Goods, Food and Beverage, Food Processing","Ancona, Marche, Italy",Mashcream is a show cooking concept based on the express production of homemade ice cream.,"269,816","European Union (EU), Europe, Middle East, and Africa (EMEA)",60131,Less than $1M,Active,2015-09-21,day,,,,,For Profit,http://www.mashcream.it,https://www.facebook.com/mashcreamitalia,https://www.linkedin.com/company/mashcream,,+39 328 9010414,Mashcream is a cooking show based on homemade ice cream. The ingredients chosen by the customer personalize the ice cream created in front of their eyes.,,,,,,,,,,,,"Consumer Goods, Food and Beverage",1,Giacomo Bizzarri,1-10,1,,2019-09-01,50000,EUR,54952,Grant,,,,,,,,50000,EUR,54952,,,,,,,,,,,,,,,,,Private,,,,,,,,,,,,,-0.6,5,,,,
Stip,https://www.crunchbase.com/organization/stip,,"Artificial Intelligence (AI), CRM, Customer Service, Information Technology, Machine Learning, SaaS, Social CRM, Software","Berkeley, California, United States",Stip is an AI-based solution for digital customer services.,"273,568","San Francisco Bay Area, West Coast, Western US",94704,Less than $1M,Active,2017-01-01,year,,,,,For Profit,https://stip.io/,https://www.facebook.com/stipapp/,https://www.linkedin.com/company/stip-ai,info@stip.io,+393474975970,"Stip is an AI-based solution that improves medium to big-size companies’ digital customer service. Being a smart layer between all text-based digital channels and CRMs. Stip can natively integrate with any CRM, chatbot and technology in a flexible and easy way. It frees customer service staff from repetitive work, allowing them to redeploy attention onto higher value work. Stip’s AI monitors all user-generated content across digital channels, identify the type of request and manages directly simple questions, saving both customer’s and operator’s time. For more complex requests, it automatically and in real-time collects all needed information and redirects it to the most accurate team, within company’s CRM. The deploy and AI training do not require the involvement of the IT team and the set-up is extremely easy.",,,,,,,,,,,,"Artificial Intelligence (AI), Data and Analytics, Information Technology, Other, Professional Services, Sales and Marketing, Science and Engineering, Software",3,"Amir Salama, Edoardo Vallebella, Fabrizio Aiello",11-50,1,Seed,2019-03-22,,,,Pre-Seed,,,,Pre-Seed,,,,,,,"SkyDeck Berkeley, Hatcher+",1,2,,,,,,,,,,,,,,Private,,,,,,,,,,,,,0,96,,,,
Lando,https://www.crunchbase.com/organization/lando-ce9f,,,"Palo Alto, California, United States",Building technology that enables enriching after-school learning,"277,564","San Francisco Bay Area, Silicon Valley, West Coast",,,Active,2021-01-01,year,,,,,For Profit,https://www.findlando.com ,https://www.facebook.com/findlando,https://www.linkedin.com/company/landointeractive,,+1 321-514-3322,,,,,,,,,,,,,,,,11-50,1,Seed,2023-08-28,,,,Seed,,,,Seed,,,,,,,Ulu Ventures,,1,,,,,,,,,,,,,,Private,,,,,,,,,,,,,2.9,,,,,
VST Technology,https://www.crunchbase.com/organization/stepp,,"Analytics, Health Care, Real Time, Software","Singapore, Central Region, Singapore","Access to the most complete motion metrics and real-time motion capture of your waist, legs and feet.","285,632","Asia-Pacific (APAC), Association of Southeast Asian Nations (ASEAN), Southeast Asia",380045,,Closed,,,,,2017-12-31,day,For Profit,,https://www.facebook.com/VST-Technology-985060284924268/,,,,"VST Technology provides access to motion metrics and real-time motion that captures its users’ waist, legs, and feet. Its product STEPP, is a revolutionary wearable device that lets runners perfect their running form and also empowers them with ability to prevent injuries. The company equips the casual runners with technology and scientific data analysis services. VST Technology is a U.S.-based company.",,,,,,,,,,,,"Data and Analytics, Health Care, Other, Software",1,Ding Shuoyu,,1,Seed,2016-01-18,100000,USD,100000,Pre-Seed,100000,USD,100000,Pre-Seed,100000,USD,100000,100000,USD,100000,"SOSV, HAX",1,2,,,,,,,,,,,,,,Private,,,,,,,,,,,,,-0.2,,,,,
TECHLAB,https://www.crunchbase.com/organization/techlab-inc,,"Biotechnology, Health Care, Manufacturing, Medical Device","Blacksburg, Virginia, United States","TECHLAB, Inc is a developer and manufacturer of intestinal diagnostics products in the United States.","286,241","East Coast, Southern US",24060-6358,$10M to $50M,Active,1989-01-01,year,2022-08-22,day,,,For Profit,http://www.techlab.com/,,https://www.linkedin.com/company/techlab,techlab@techlab.com,(540)953-1664,"TechLab, Inc is a developer and manufacturer of intestinal diagnostics products in the United States. Founded in 1989, the Company is headquartered in Blacksburg, VA and has a state-of-the-art manufacturing facility in Radford, VA. TechLab’s patented QUIK CHEK® rapid tests deliver extremely accurate results in 30 minutes. The Company has a market leading portfolio of diagnostic tests for intestinal diseases including C. difficile (C. Diff) bacteria, parasitology and inflammation.",,,,,,,,,,,,"Biotechnology, Health Care, Manufacturing, Science and Engineering",1,David Lyerly,101-250,,M&A,,,,,,,,,,,,,,,,,,,,Was Acquired,TECHLAB acquired by SSI Diagnostica,https://www.crunchbase.com/acquisition/ssi-diagnostica-acquires-techlab-inc--bd52148e,SSI Diagnostica,https://www.crunchbase.com/organization/ssi-diagnostica,2022-08-22,day,,,,Merger,,Private,,,,,,,,,,,,,2.5,5,21,11,Testing,"Pharmaceutical, veterinary and sanitary products"
Hotels By Day,https://www.crunchbase.com/organization/hotelsbyday,,"Hospitality, Hotel, Software, Travel, Vacation Rental","New York, New York, United States",Create protocols to enable hotels to smoothly transition towards our ‘on-demand everything’ society.,"287,612","Greater New York Area, East Coast, Northeastern US",10017,Less than $1M,Active,2014-06-18,day,,,,,For Profit,http://www.hotelsbyday.com,https://www.facebook.com/hotelsbyday,https://www.linkedin.com/company/hotelsbyday,frontdesk@hotelsbyday.com,(855) 925-2530,"Enable properties to smoothly transition towards our ‘on-demand everything’ society.  The holding company Hospitality Innovated (HI), created easy to adopt protocols so that Hotels can offer more flexibility while ‘Hyper-Inflating’ revenues by monetizing & optimizing room downtime.  With 95 years of accumulated experience in the Hospitality field, HI’s team has a track record of successful ventures targeting Operations, Revenue Management, Travel Tech & Communications, unlocking inefficiencies in the Hotel space and boosting guest experience. www.hotelsbyday.com  www.flex-book.com",,,,,,,,,,,,"Real Estate, Software, Travel and Tourism",3,"Brian Dass, Nathan Stevenson, Yannis Moati",1-10,2,Seed,2020-12-01,,,,Non-equity Assistance,,,,Seed,,,,,,,Newchip Accelerator,,1,1,Made Acquisitions,,,,,,,,,,,,Private,,,,,,,,,,,,,-0.2,9,0,2,,Services for providing food and drink; temporary accommodations
Ragnarok,https://www.crunchbase.com/organization/ragnarok,,"Advertising, Content Creators, Content Marketing, CRM, Email, Email Marketing, Video, Video Advertising, Web Design, Web Development","New York, New York, United States",Ragnarok is a full-service agency that bridges the gap between creativity and technology.,"293,586","Greater New York Area, East Coast, Northeastern US",10018,$1M to $10M,Active,2012-04-01,month,,,,,For Profit,https://ragnaroknyc.com/,https://www.facebook.com/ragnaroknyc/,https://www.linkedin.com/company/ragnarok-nyc/,info@ragnaroknyc.com,(212) 600-1788,,,,,,,,,,,,,"Advertising, Design, Information Technology, Internet Services, Media and Entertainment, Messaging and Telecommunications, Sales and Marketing, Software, Video",2,"Spencer Barrett, Steven Aldrich",101-250,,,,,,,,,,,,,,,,,,,,,,,,,,,,,,,,,,Private,,,,,,,,,,,,,-1.1,10,,,,
DG1 Group Holdings,https://www.crunchbase.com/organization/ecommearth,,"Analytics, SaaS, Software, Web Development","Vancouver, British Columbia, Canada",DG1 Group Holdings is a cloud-based e-business software company.,"299,949",,V6C 3H1,$1M to $10M,Active,2016-08-15,day,,,,,For Profit,https://www.dg1.com,https://www.facebook.com/dg1platform/,https://www.linkedin.com/company/dg1,info@dg1.com,+1 604 670 7533,"DG1 Group Holdings is a web-based AI platform that provides solutions for businesses to grow online. They provide features such as e-commerce, website building, newsletter creation, scheduling, booking, a mobile app, and big data ownership.",,,,,,,,,,,,"Data and Analytics, Software",1,Gregor Zebic,51-100,,,,,,,,,,,,,,,,,,,,,,,,,,,,,,,,,,Private,,,,,,,,,,,,,0.2,10,,,,
Peekaboo,https://www.crunchbase.com/organization/peekaboo-a8bb,,"Business Development, Communities, Education, Incubators, Innovation Management","Rome, Lazio, Italy",Open Innovation Startup Community,"300,339","European Union (EU), Europe, Middle East, and Africa (EMEA)",00144,,Active,2013-01-01,year,,,,,For Profit,https://www.peekaboovision.com,https://www.facebook.com/peekaboo.vision,https://www.linkedin.com/company/peekaboo-npo/,social@peekaboo.vision,,"Peekaboo is the biggest community in Italy of founders, mentors and advisors who work together to create and grow startups in the pre-acceleration phase. Our mission is to help companies and individuals to take the most difficult step, the first one! To do this we offer entrepreneurial support, connecting the original ideas of young entrepreneurs with companies that can support their projects through Open Innovation strategies, by creating business modeling programs and accelerating possible partnerships with other companies.  Our activities can be synthesized into 4 main categories: - Lean Startup Program (Rome/Milan) - Open Innovation Management - Vertical pre acceleration - Startup Program Online In the last two years we have supported more than 100 digital projects by applying methodologies, tools and technologies adopted by the best companies in Silicon Valley.",,,,,,,,,,,,"Community and Lifestyle, Education, Financial Services, Lending and Investments, Professional Services",1,Paolo Napolitano,1-10,,,,,,,,,,,,,,,,,,,,,,,,,,,,,,,,,,Private,,,,,,,,,,,,,7.7,1,,,,
Metis,https://www.crunchbase.com/organization/metis,,"Career Planning, Education, Employment","Boston, Massachusetts, United States","Metis accelerates careers in data science. Our immersive courses provide intensive, on-site instruction and job placement support.","301,212","Greater Boston Area, East Coast, New England",02108,$50M to $100M,Active,2013-01-01,year,,,,,For Profit,http://thisismetis.com,https://www.facebook.com/thisismetis,https://www.linkedin.com/school/metis/,info@thisismetis.com,646.780.0191,"Metis facilitates boot camps, events, online training programs, part-time professional development programs, and corporate programs that focus on the career development of data scientists. Metis offers an online platform that enables its users to find information about its events and training programs. Metis has offices in Chicago, New York, San Francisco, and Seattle. It was founded by Jason Moss in 2013.",,,,,,,,,,,,"Education, Professional Services",1,Jason Moss,11-50,,,,,,,,,,,,,,,,,,,,,,,,,,,,,,,,,,Private,,,,,,,,,,,,,-0.6,7,,,,
DeepEn,https://www.crunchbase.com/organization/deepen-0507,,Biotechnology,"Jena, Thuringen, Germany",DeepEn is a research transfer start-up from Leibniz Institute of Photonic Technologies.,"302,050","European Union (EU), Europe, Middle East, and Africa (EMEA)",07745,,Active,2024-01-01,year,,,,,For Profit,https://deepen-imaging.com,,https://www.linkedin.com/company/deepen-imaging,info@deepen-imaging.com,+49 (0) 3641 8987224,"DeepEn is a research transfer start-up from Leibniz Institute of Photonic Technologies. It focus on the development of solutions in the field of fibrephotonics, biophotonics and bioimaging.",,,,,,,,,,,,"Biotechnology, Science and Engineering",,,1-10,1,Seed,2025-02-17,,,,Seed,,,,Seed,,,,,,,"bm-t beteiligungsmanagement thuringen, Mittelständische Beteiligungsgesellschaft Thüringen, Sparkasse Jena",,3,,,,,,,,,,,,,,Private,,,,,,,,,,,,,-1.2,,,,,
Delmar International,https://www.crunchbase.com/organization/delmar-international,,"Consulting, Freight Service, Logistics, Warehousing","Lachine, Quebec, Canada","Delmar International is a provider of customs brokerage, international freight forwarding, logistics, consulting and Information services.","311,124",,,$100M to $500M,Active,1965-01-01,day,,,,,For Profit,http://www.delmarcargo.com/,http://www.facebook.com/delmarcargo,https://www.linkedin.com/company/delmar-international-inc-/,info@delmarcargo.com,514-636-8800,"Delmar International is a provider of customs brokerage, international freight forwarding, logistics, consulting and Information services.",,,,,,,,,,,,"Professional Services, Transportation",,,1001-5000,,,,,,,,,,,,,,,,,,,,,1,Made Acquisitions,,,,,,,,,,,,Private,,,,,,,,,,,,,2.8,10,0,6,,"Transport, packaging and storing"
HypeX,https://www.crunchbase.com/organization/hypex-d189,,"Blockchain, Cryptocurrency","Los Angeles, California, United States",HypeX is a Web 3.0 company that brings liquidity and utility to all assets.,"311,533","Greater Los Angeles Area, West Coast, Western US",,Less than $1M,Active,2021-07-01,day,,,,,For Profit,https://www.hypex.io,https://www.facebook.com/HPXexchange/,https://www.linkedin.com/company/hypex-io,info@hypex.us,,,,,,,,,,,,,,"Blockchain and Cryptocurrency, Financial Services, Other, Payments, Software",1,Stark Zhang,1-10,1,Seed,2021-10-01,,,,Seed,,,,Seed,,,,,,,,,,,,,,,,,,,,,,,Private,,,,,,,,,,,,,0,6,,,,
INOFEA,https://www.crunchbase.com/organization/inofea,,"Bioinformatics, Biotechnology, Health Care","Basel, Basel-Stadt, Switzerland",INOFEA is a biotech company that offers a platform technology capable to fit enzymes in vivo and process conditions.,"327,740","Europe, Middle East, and Africa (EMEA)",CH-4057,Less than $1M,Active,2014-01-01,year,,,,,For Profit,http://inofea.com,,https://www.linkedin.com/company/inofea,info@inofea.ch,+41 61 633 30 11,"INOFEA AG is a biotech company that offers a platform technology capable to fit enzymes in vivo and process conditions. The company was founded in 2014 and is headquartered in Basel, Switzerland.",,,,,,,,,,,,"Biotechnology, Data and Analytics, Health Care, Science and Engineering",,,1-10,4,,2024-11-29,,,,Venture - Series Unknown,,,,Venture - Series Unknown,,,,10000,CHF,10360,"Venture Kick, Business Angels Switzerland (BAS)",2,2,,,,,,,,,,,,,,Private,,,,,,,,,,,,,-0.1,10,4,1,Biochemistry; Beer; Spirits; Wine; Vinegar; Microbiology; Enzymology; Mutation Or Genetic Engineering,Scientific and technological services
Bac3Gel,https://www.crunchbase.com/organization/bac3gel,,"Biotechnology, Health Care, Medical, Therapeutics","Porto Salvo, Lisboa, Portugal",Bac3Gel specializes in mucus models to harness microbiota in vitro and deliver new microbiome-based therapeutics.,"332,441","European Union (EU), Europe, Middle East, and Africa (EMEA)",2740-122,$1M to $10M,Active,2020-06-17,day,,,,,For Profit,https://www.bac3gel.com/,https://www.facebook.com/Bac3Gel/,https://www.linkedin.com/company/bac3gel/,contact@bac3gel.com,+351918658193,"Unlocking the Full Power of Microbiota Bac3Gel is a deep-tech biotechnology company revolutionizing microbiota research and applications through its innovative biomaterials and culture systems. Its proprietary technology enables the cultivation, analysis, and harnessing of microbiota in a way that was previously impossible, bridging critical gaps in preclinical research, biotech production, and future therapeutic development. Technology & Core Innovation Bac3Gel’s platform is built around a tailorable biomimetic system that provides microbiota with the precise microenvironmental conditions they need to thrive. Unlike conventional in vitro culture methods, Bac3Gel’s system mimics natural microbiota habitats, allowing researchers and biotech companies to work with complex microbial ecosystems in a reproducible and scalable manner. Bac3Gel’s biomaterials are: Ready-to-use – no complex setup required, Customizable – adaptable to different microbial ecosystems, Biomimetic – replicates key physiological conditions of native microbiota environments, Scalable – suitable for both small-scale research and industrial applications, Ethical & Sustainable – reducing the need for animal models. Products & Applications 1. Microbiota Culturing - Ready-to-use In-vitro Mucus Models Bac3Gel offers advanced mucus-like matrices that replicate the native conditions of various human body sites, enabling high-throughput screening, microbiota research, and drug discovery. These models are compatible with:  Gut microbiota studies, Gastric and intestinal research, Cervico-vaginal microbiome studies, Lung and respiratory microbiota analysis, Microfluidic and high-throughput applications. 2. Growth Enhancer Beads These proprietary microbeads are designed to boost the proliferation of hard-to-culture microbes, unlocking new possibilities in microbiome-based therapeutics, probiotics, and industrial microbiology.   - Compatible with bioreactors – scalable for industrial applications.   - Enhances microbiota growth – especially beneficial for strict anaerobes and difficult-to-culture strains.   - Facilitates microbial metabolite extraction – enabling biotechnology applications.   - Increases production yield – improving efficiency in biotech and pharmaceutical production. Future Vision: 2026: Expand into microbiome-based health and supplement markets. 2029-2030: Develop next-generation biotherapeutics leveraging microbiota ecosystems.",,,,,,,,,,,,"Biotechnology, Health Care, Science and Engineering",5,"Daniela Pacheco, Livia Visai, Paola Petrini, Sebastião van Uden, Sonja Visentin",1-10,,,,,,,,,,,,,,,,,,,,,,,,,,,,,,,,,,Private,,,,,,,,,,,,,-0.8,7,0,2,,Chemical substances
Nano-Tech,https://www.crunchbase.com/organization/nano-tech,,"Industrial, Manufacturing, Nanotechnology","Ascoli Piceno, Marche, Italy","Nano-Tech manufactures, researches, develops, and supports materials.","335,348","European Union (EU), Europe, Middle East, and Africa (EMEA)",63031,$1M to $10M,Active,2011-01-01,year,,,,,For Profit,https://italnanotech.com,https://www.facebook.com/italnanotech,https://www.linkedin.com/company/nano-tech-srl,info@italnanotech.com,+39 0736 654050,"Nano-Tech provides technological solutions to customers. They deliver material solutions for industry leaders. They provide industry-leading R&D, advanced production capabilities, and world-class support. They offer industrial and social advancement. They provide applications including sensors, antistatic thin films, and controlling the static and electromagnetic environments of electronic components.",,,,,,,,,,,,"Manufacturing, Science and Engineering",3,"Donato Giovannelli, Patricia Barcala Domìnguez, Valerio Alessi",1-10,1,,2021-05-17,,,,Grant,,,,,,,,,,,EIC Accelerator,1,1,,,,,,,,,,,,,,Private,,,,,,,,,,,,,0,9,4,4,Organic Macromolecular Compounds; Their Preparation Or Chemical Working-Up,Chemical substances
Wmd,https://www.crunchbase.com/organization/wmd-c71a,,"Advertising, Brand Marketing, Digital Marketing, Web Design","Miami Beach, Florida, United States","Wmd is an agency that offers web design, development, and online marketing solutions based on the latest technology for brand development.","336,485","Greater Miami Area, East Coast, Southern US",33139,Less than $1M,Active,2017-01-01,year,,,,,For Profit,https://wm.digital,https://www.facebook.com/wmdigitalagency/,https://www.linkedin.com/company/wm.digital/,hello@wm.digital,+1 3057047618,,,,,,,,,,,,,"Advertising, Design, Sales and Marketing",1,Sze Liu,1-10,,,,,,,,,,,,,,,,,,,,,,,,,,,,,,,,,,Private,,,,,,,,,,,,,3.7,4,,,,
