Bacfarm,https://www.crunchbase.com/organization/bacfarm,,AgTech,"Cagliari, Sardegna, Italy",provide innovative solutions developed through an accurate academic research and to create the best natural products for our customers,"948,187","European Union (EU), Europe, Middle East, and Africa (EMEA)",,,Active,2019-01-01,month,,,,,For Profit,https://bacfarm.com/,,https://www.linkedin.com/company/bacfarm/,,,,,,,,,,,,,,,Agriculture and Farming,1,Giulia GUADALUPI,1-10,1,,2019-01-01,,,,Undisclosed,,,,Undisclosed,,,,,,,,,,,,,,,,,,,,,,,Private,,,,,,,,,,,,,0,,,,,
Busrapido.com,https://www.crunchbase.com/organization/busrapido-com,,"Business Travel, E-Commerce, Transportation, Travel","Rome, Lazio, Italy",The online booking platform for private bus charters.,"959,231","European Union (EU), Europe, Middle East, and Africa (EMEA)",,,Active,2016-05-02,day,2021-09-21,day,,,For Profit,https://busrapido.com,https://www.facebook.com/busrapidohq/,https://www.linkedin.com/company/busrapidohq,info@busrapido.com,,"Busrapido.com is a booking platform for private bus charters that makes it easy and affordable to book private buses for traveling in a group. Today you can book online hotel rooms, flights, car rentals, yachts, private jets, but not private buses. Busrapido has made booking buses online possible for everyone. On Busrapido users can instantly see prices, reviews, photos, environmental classes, on-board features, and choose the best bus for their trip. Whether you are planning a wedding, a business event, or a group trip with your friends, Busrapido.com is the right solution for you. We search thousands of vehicles for every trip, and show you the best available options in real time. We only work with bus rental companies who meet Busrapido quality standards, so you can rest assured it will be a smooth ride. Our clients are all companies, schools, travel agencies, tour operators, societies, sport clubs and all event, concerts and congress organizers who book private buses to move people in group. Helping people to find and book the right bus for their journeys, Busrapido.com makes group traveling around the world more accessible to everyone. Our team is based in London and Rome, in a sunny office in the heart of Trastevere.",,,,,,,,,,,,"Commerce and Shopping, Transportation, Travel and Tourism",3,"Gabriele Saija, Roberto Ricci, Simone Primarosa",1-10,,M&A,,,,,,,,,,,,,,,,,,,,Was Acquired,Busrapido.com acquired by Busforfun,https://www.crunchbase.com/acquisition/busforfun-acquires-busrapido-com--8a15c431,Busforfun,https://www.crunchbase.com/organization/busforfun,2021-09-21,day,,,,Acquisition,,Private,,,,,,,,,,,,,-0.9,4,,,,
Lili Margo,https://www.crunchbase.com/organization/lili-margo,,"Cosmetics, E-Commerce, Manufacturing, Sales","Malakoff, Ile-de-France, France",Lili Margo is a manufacturer of skincare products.,"964,782","European Union (EU), Europe, Middle East, and Africa (EMEA)",92240,,Active,2017-01-01,year,,,,,For Profit,https://lilimargo.com ,https://www.facebook.com/lilimargoparis/,https://www.linkedin.com/company/lilimargo/ ,contact@lilimargo.com,+33 01 71 54 71 86,"Lili Margo's products include lotions, serums, creams,  eye contours, lip balms, exfoliators, masks and patches, and accessories. The products are also available online. The contact mode is by mail, phone, and physical address.",,,,,,,,,,,,"Commerce and Shopping, Consumer Goods, Manufacturing, Sales and Marketing",1,Gérard Mouradian,11-50,,,,,,,,,,,,,,,,,,,,,,,,,,,,,,,,,,Private,,,,,,,,,,,,,-0.8,28,0,3,,"Bleaching, cleaning, polishing, scouring and abrasive preparations; cosmetics"
Ventuno,https://www.crunchbase.com/organization/ventuno,,"Consulting, Information Technology, Software, Training","Hanover, Niedersachsen, Germany","Ventuno is an information technology company that provides software design, training, and consulting services.","982,298","European Union (EU), Europe, Middle East, and Africa (EMEA)",30159,$1M to $10M,Active,2006-01-01,year,,,,,For Profit,https://www.ventuno.de,https://www.facebook.com/ventunoGmbH,https://www.linkedin.com/company/ventuno-gmbh,kontakt@ventuno.de,+49 511 763536-0,,,,,,,,,,,,,"Education, Information Technology, Professional Services, Software",,,11-50,,,,,,,,,,,,,,,,,,,,,,,,,,,,,,,,,,Private,,,,,,,,,,,,,-2,94,,,,
istella,https://www.crunchbase.com/organization/istella,,"Internet, Search Engine","Cagliari, Sardegna, Italy",Italian search engine,"1,029,494","European Union (EU), Europe, Middle East, and Africa (EMEA)",,,Active,2013-01-01,year,,,,,For Profit,http://www.istella.it/,http://www.facebook.com/istella.it,http://www.linkedin.com/company/istella/,,,,,,,,,,,,,,,Internet Services,2,"Domenico Dato, Renato Soru",,,,,,,,,,,,,,,,,,,,,,,,,,,,,,,,,,,Private,,,,,,,,,,,,,-0.8,10,1,0,Computing; Calculating,
Mperience,https://www.crunchbase.com/organization/mperience,,"Architecture, Art, Database, Film, Social Media","Rome, Lazio, Italy","Mperience is a social media platform about cinema, literature and art.","1,041,828","European Union (EU), Europe, Middle East, and Africa (EMEA)",,,Active,2009-12-01,month,,,,,For Profit,http://www.mperience.com,,,,390645422904,,,,,,,,,,,,,"Data and Analytics, Internet Services, Media and Entertainment, Real Estate, Software, Video",,,11-50,1,Seed,2013-09-09,800000,EUR,1059465,Seed,800000,EUR,1059465,Seed,800000,EUR,1059465,800000,EUR,1059465,INGENIUM Emilia Romagna,1,1,,,,,,,,,,,,,,Private,,,,,,,,,,,,,-0.2,6,0,1,,Telecommunications
i4,https://www.crunchbase.com/organization/i4,,"Cyber Security, IT Infrastructure, Network Security, Professional Networking","Ede, Gelderland, The Netherlands","i4 is an IT firm that provides IT infrastructure, cyber security, cloud monitoring, and managed networking services.","1,043,384","European Union (EU), Europe, Middle East, and Africa (EMEA)",6716,,Active,2010-01-01,year,,,,,For Profit,https://www.i4projects.nl,https://www.facebook.com/i4projects/,https://www.linkedin.com/company/i4-managed-it-services,info@i4.nl,+31 088-304-0701,,,,,,,,,,,,,"Community and Lifestyle, Information Technology, Privacy and Security, Professional Services",,,11-50,,,,,,,,,,,,,,,,,,,,,,,,,,,,,,,,,,Private,,,,,,,,,,,,,-2,22,,,,
ELESTA GMBH,https://www.crunchbase.com/organization/elesta-gmbh,,"Electrical Distribution, Electronics, Manufacturing","Bad Ragaz, Sankt Gallen, Switzerland","ELESTA GmbH is a company based in Switzerland that manufactures control systems, measurement systems, and light optical sensors.","1,044,429","Europe, Middle East, and Africa (EMEA)",7310,,Active,1997-01-01,day,,,,,For Profit,https://www.elesta-gmbh.com,https://www.facebook.com/elestagmbh,https://www.linkedin.com/company/elesta-relays-gmbh/,admin@elesta-gmbh.com,+41 81 303 54 00,,,,,,,,,,,,,"Consumer Electronics, Energy, Hardware, Manufacturing",,,251-500,,,,,,,,,,,,,,,,,,,,,,,,,,,,,,,,,,Private,,,,,,,,,,,,,5.9,4,1,3,Testing,Scientific and electric apparatus and instruments
Natea,https://www.crunchbase.com/organization/natea,,"Artificial Intelligence (AI), Hardware, Machine Learning, Software","Roma, Lazio, Italy","Natea develops and markets software and hardware solutions for observation, treatment, and analysis.","1,049,982","European Union (EU), Europe, Middle East, and Africa (EMEA)",00182,$1M to $10M,Active,2021-01-01,year,,,,,For Profit,https://natea.it,,https://www.linkedin.com/company/natea-ai,info@natea.it,+39 3931492717,,,,,,,,,,,,,"Artificial Intelligence (AI), Data and Analytics, Hardware, Science and Engineering, Software",1,Mauro Cofelice,1-10,,,,,,,,,,,,,,,,,,,,,,,,,,,,,,,,,,Private,,,,,,,,,,,,,2.3,1,,,,
Cesynt Advanced Solutions,https://www.crunchbase.com/organization/cesynt-advanced-solutions-2707,,"E-Learning, Technical Support, Training","Roma, Lazio, Italy",Cesynt Advanced Solutions provides companies with technological solutions for e-learning.,"1,073,800","European Union (EU), Europe, Middle East, and Africa (EMEA)",00183,$1M to $10M,Active,2010-01-01,year,,,,,For Profit,https://www.cesyntas.eu,https://www.facebook.com/cesyntadvancedsolutions,https://www.linkedin.com/company/cesynt-advanced-solutions-s-r-l-/,info@cesyntas.com,+39 06 9293 7611,"Cesynt Advanced Solutions provides learning management systems. Their services include management consulting, online training, web development, e-learning, training management systems, e-learning platform, business training, and professional training.",,,,,,,,,,,,"Education, Information Technology, Other, Software",,,11-50,,,,,,,,,,,,,,,,,,,,,,,,,,,,,,,,,,Private,,,,,,,,,,,,,-1,10,,,,
Cell Receptor,https://www.crunchbase.com/organization/cell-receptor-inc,,"Biotechnology, Health Care, Life Science, Medical, Pharmaceutical","Geneva, Geneve, Switzerland",Cell Receptor develops a future-oriented therapy for high medical needs: cancer and autoimmune diseases,"1,096,293","Europe, Middle East, and Africa (EMEA)",1211,,Active,2010-01-01,year,,,,,For Profit,https://cellreceptor.ch/,,https://www.linkedin.com/company/cell-receptor,info@cellreceptor.ch,,"Cell Receptor is a small Geneva based startup company, aiming to establish a new option in the treatment of cancer and autoimmune diseases: The Cell Receptor team has since 2010 been actively engaged in research on cell proliferation and possesses unique knowledge of a very basic control mechanism of cell growth in our body,  that was previously unknown and therefore has not been the subject of therapeutic efforts. Cell Receptor has also knowledge of groups of pharmacological substances able to interfere with this mechanism, and has, basing thereupon, developed a new method for the prevention of cancer metastases. The treatment has the potential to inhibit cancer metastasis at very reasonable costs. Therefore, it is expected that the clinical demand and thus the expected sales will be quite substantial. Cell Receptor will fund a clinical trial as a proof of its concept and is expanding its activities for this purpose.",,,,,,,,,,,,"Biotechnology, Health Care, Science and Engineering",,,,,,,,,,,,,,,,,,,,,,,,,,,,,,,,,,,,,Private,,,,,,,,,,,,,3.4,16,3,0,Medical Or Veterinary Science; Hygiene,
Sunreport,https://www.crunchbase.com/organization/sunreport,,"Apps, Energy, Solar","Villesse, Friuli-Venezia Giulia, Italy",Sunreport is a software company that provides a photovoltaic cloud for monitoring photovoltaic systems.,"1,113,529","European Union (EU), Europe, Middle East, and Africa (EMEA)",34070,$1M to $10M,Active,,,,,,,For Profit,https://www.sunreport.it,https://www.facebook.com/sunreport,https://www.linkedin.com/company/sunreport,info@sunreport.it,+39 0481 1990339,"Sunreport is a software that reads the GSE, energy distributors, smart meters, inverters, and devices and displays complete data of all photovoltaic systems. The company provides a photovoltaic cloud to monitor their photovoltaic systems. Their devices include meter readers, advanced residential displays, and energy-aware devices.",,,,,,,,,,,,"Apps, Energy, Natural Resources, Software, Sustainability",1,Stephen Roppa,1-10,,,,,,,,,,,,,,,,,,,,,,,,,,,,,,,,,,Private,,,,,,,,,,,,,7,9,1,1,Electric Communication Technique,Scientific and electric apparatus and instruments
Biorenova,https://www.crunchbase.com/organization/biorenova,,"Environmental Consulting, Industrial, Information and Communications Technology (ICT), Innovation Management","Montorio Al Vomano, Abruzzi, Italy",Biorenova is an innovative start-up firm that creates technologies and expertise required to successfully turn a concept into a business.,"1,122,834","European Union (EU), Europe, Middle East, and Africa (EMEA)",64066,Less than $1M,Active,2015-01-01,year,,,,,For Profit,https://www.biorenovatech.com/,,,info@biorenovatech.com,,,,,,,,,,,,,,"Information Technology, Manufacturing, Professional Services",,,1-10,,,,,,,,,,,,,,,,,,,,,,,,,,,,,,,,,,Private,,,,,,,,,,,,,2.1,1,2,0,Biochemistry; Beer; Spirits; Wine; Vinegar; Microbiology; Enzymology; Mutation Or Genetic Engineering,
Cam.TV,https://www.crunchbase.com/organization/cam-tv,,"Blockchain, Communities, Internet, Social Media, TV","Gonars, Friuli-Venezia Giulia, Italy",Cam.TV is a technological platform utilizing blockchain technology.,"1,165,007","European Union (EU), Europe, Middle East, and Africa (EMEA)",33050,,Active,2017-01-01,year,,,,,For Profit,https://www.cam.tv/,https://www.facebook.com/camtvsocial/,https://www.linkedin.com/company/cam-tv/,support@cam.tv,+39 351 546 6000,"Cam.TV is a platform where you can analyze your passions and share valuable content with the support of its community. Their goal is to create a technological platform based on intuitive blockchain technology, fast and provides all the tools necessary to create, share, and monetize content and make it accessible to those seeking quality information online.",,,,,,,,,,,,"Blockchain and Cryptocurrency, Community and Lifestyle, Internet Services, Media and Entertainment, Other, Video",1,Gabriele Visintini,11-50,,,,,,,,,,,,,,,,,,,,,,,,,,,,,,,,,,Private,,,,,,,,,,,,,-0.5,8,,,,
PREINVEL,https://www.crunchbase.com/organization/preinvel,,"Environmental Consulting, Health Care, Industrial, Service Industry","Grottaglie, Puglia, Italy",PREINVEL is a startup with a social vocation that deals with the environment and human health.,"1,165,557","European Union (EU), Europe, Middle East, and Africa (EMEA)",,,Active,2016-01-01,day,,,,,For Profit,http://www.preinvel.com/,https://www.facebook.com/PREINVEL/,https://www.linkedin.com/company/preinvel/,info@preinvel.com,39-328 231 2816,,,,,,,,,,,,,"Health Care, Manufacturing, Other, Professional Services",,,1-10,1,,2020-10-21,,,,Non-equity Assistance,,,,,,,,,,,MassChallenge,1,1,,,,,,,,,,,,,,Private,,,,,,,,,,,,,0,2,,,,
ARDIS,https://www.crunchbase.com/organization/ardis,,"Information Technology, Manufacturing, Software","Apex, North Carolina, United States",ARDIS is a software company that specializes in optimization and manufacturing software for the sheet/bar/coil cutting sector.,"1,166,160","Research Triangle, East Coast, Southern US",27502,$1M to $10M,Active,1983-01-01,year,,,,,For Profit,https://www.ardisus.com,https://www.facebook.com/ARDISInformationSystems/,https://www.linkedin.com/company/ardis-information-systems-n-v-/,info@ardis.eu,32 50 72 89 89,,,,,,,,,,,,,"Information Technology, Manufacturing, Software",,,11-50,,,,,,,,,,,,,,,,,,,,,,,,,,,,,,,,,,Private,,,,,,,,,,,,,-0.6,7,,,,
EarthBi,https://www.crunchbase.com/organization/earthbi,,"Biomass Energy, Biotechnology, Recycling, Waste Management","Termoli, Molise, Italy",EarthBi is a biotechnology company that allows to print of complex and detailed plastic products.,"1,168,810","European Union (EU), Europe, Middle East, and Africa (EMEA)",86039,,Active,2018-01-01,year,,,,,For Profit,https://earthbi.io,https://www.facebook.com/earthbi.io,https://www.linkedin.com/company/earthbi,info@earthbi.io,+39 0874 1896641,"EarthBi combines the virtual world through the creation of a special token utility for the green sector called ERA with the production of polymers with characteristics of high biodegradability and quality and wide use. The project, in essence, is aimed at the diffusion of innovative biopolymers, generated thanks to proprietary industrial property rights. EarthBi project will also have use of the full traceability of the production chain thanks to the use of blockchain technology in order to guarantee customers and consumers the qualities and characteristics declared.",,,,,,,,,,,,"Biotechnology, Energy, Natural Resources, Science and Engineering, Sustainability",2,"Francesco Improta, Mauro Pedretti",1-10,,,,,,,,,,,,,,,,,,,,,,,,,,,,,,,,,,Private,,,,,,,,,,,,,-0.9,14,1,1,Organic Macromolecular Compounds; Their Preparation Or Chemical Working-Up,Chemical substances
L4T,https://www.crunchbase.com/organization/l4t,,"Apparel, Product Design, Sales","Osaka-shi, Osaka, Japan","L4T provides sales, planning, production, and import services for apparel.","1,169,748",Asia-Pacific (APAC),541-0054,$1M to $10M,Active,,,,,,,For Profit,https://www.l4t.biz/,https://www.facebook.com/p/%E6%A0%AA%E5%BC%8F%E4%BC%9A%E7%A4%BE%E3%82%A8%E3%83%AB%E3%83%95%E3%82%A9%E3%83%BC%E3%83%86%E3%82%A3%E3%83%BC-100076211186437/,,info@l4t.biz,+81 066-226-8726,,,,,,,,,,,,,"Clothing and Apparel, Design, Sales and Marketing",,,1-10,,,,,,,,,,,,,,,,,,,,,,,,,,,,,,,,,,Private,,,,,,,,,,,,,5.5,10,,,,
Anemotech,https://www.crunchbase.com/organization/anemotech,,"Environmental Consulting, Pollution Control, Product Design","Milan, Lombardia, Italy",Anemotech specializes in the development of products and technologies to reduce air pollution in indoor and outdoor environments.,"1,212,784","European Union (EU), Europe, Middle East, and Africa (EMEA)",20122,$1M to $10M,Active,2014-01-01,year,,,,,For Profit,https://www.thebreath.it/,https://www.facebook.com/AnemotechTheBreath/,https://www.linkedin.com/company/anemotech---the-breath/,info@anemotech.it,+39 024 795 1759,,,,,,,,,,,,,"Design, Professional Services, Sustainability",,,1-10,,,,,,,,,,,,,,,,,,,,,,,,,,,,,,,,,,Private,,,,,,,,,,,,,6.4,4,2,3,Physical Or Chemical Processes Or Apparatus In General,Environmental control apparatus
MediaPharma,https://www.crunchbase.com/organization/mediapharma,,"Biotechnology, Oncology, Pharmaceutical","Chieti, Abruzzi, Italy",BIotech company specialized in oncology with ADC,"1,213,848","European Union (EU), Europe, Middle East, and Africa (EMEA)",66013,$1M to $10M,Active,2011-01-01,year,,,,,For Profit,http://www.mediapharma.it,,https://www.linkedin.com/company/mediapharma-s.r.l.,info@mediapharma.it,39 0871 54 15 37,MediaPharma is an Italian drug discovery Biotech company active in oncology and focused on human antibodies and ADCs.,,,,,,,,,,,,"Biotechnology, Health Care, Science and Engineering",,,1-10,,,,,,,,,,,,,,,,,,,,,,,,,,,,,,,,,,Private,,,,,,,,,,,,,-2.3,10,8,2,Medical Or Veterinary Science; Hygiene,"Pharmaceutical, veterinary and sanitary products"
DeepCyber,https://www.crunchbase.com/organization/deepcyber,,"Cyber Security, Fraud Detection, Information Technology, Security","Rome, Lazio, Italy",DeepCyber aids in developing cyber threat intelligence and response capabilities with an intelligence-driven approach.,"1,231,395","European Union (EU), Europe, Middle East, and Africa (EMEA)",,$1M to $10M,Active,,,,,,,For Profit,https://www.deepcyber.it,https://www.facebook.com/profile.php?id=100068004246610,https://www.linkedin.com/company/deepcyber,info@deepcyber.it,39 06 5894164,"DeepCyber specializes in enhancing the cyber threat intelligence, protection, and response capabilities of its clients through an intelligence-driven approach. The company focuses on developing the skills and strategies necessary for proactive detection and effective response to cyber threats. DeepCyber's team of specialists provides support in building and strengthening cyber defense mechanisms, catering primarily to the banking industry. The company emphasizes on empowering its clients with the knowledge and tools required to safeguard their digital assets against evolving cyber threats.",,,,,,,,,,,,"Financial Services, Information Technology, Payments, Privacy and Security",,,11-50,,,,,,,,,,,,,,,,,,,,,,,,,,,,,,,,,,Private,,,,,,,,,,,,,-0.9,10,,,,
Revice,https://www.crunchbase.com/organization/revice,,"Apparel, E-Commerce, Fashion, Manufacturing, Retail","Los Angeles, California, United States","Revice manufactures vintage-inspired denim products, sold directly to customers via their website.","1,230,643","Greater Los Angeles Area, West Coast, Western US",,$1M to $10M,Active,,,,,,,For Profit,https://revicedenim.com,https://www.facebook.com/p/REVICE-100067961389898,https://www.linkedin.com/company/revice-denim,shai@re-vice.com,,"Revice is a company that specializes in the manufacturing of denim products. The company offers a range of vintage-inspired denim products that are sold directly to customers. The products are designed in Los Angeles, California and are handmade. The company's product line includes jeans of various sizes, from XS to XXL. Revice Denim's products are only available for purchase on their official website, revicedenim.com. The company also offers a return policy and shipping support for their customers.",,,,,,,,,,,,"Clothing and Apparel, Commerce and Shopping, Design, Manufacturing",,,11-50,,,,,,,,,,,,,,,,,,,,,,,,,,,,,,,,,,Private,,,,,,,,,,,,,-0.5,12,,,,
IntegrityKEY,https://www.crunchbase.com/organization/integritykey,,"Blockchain, Food Processing, Internet of Things","Ancona, Marche, Italy",IntegrityKEY promotes authenticity by monitoring and certifying food standards.,"1,231,582","European Union (EU), Europe, Middle East, and Africa (EMEA)",60131,,Active,2019-01-01,year,,,,,For Profit,https://integritykey.srl,,https://www.linkedin.com/company/integrity-key,info@integritykey.it,+39 3319123650,"IntegrityKEY provides food supply chains, blockchain technology, food traceability, internet of things, food quality, and digitalization in the food chain services. The contact mode is by mail, phone, and physical address.",,,,,,,,,,,,"Blockchain and Cryptocurrency, Food and Beverage, Internet Services, Other",1,Ancuta Nartea,1-10,,,,,,,,,,,,,,,,,,,,,,,,,,,,,,,,,,Private,,,,,,,,,,,,,4.7,,,,,
Morelli Group,https://www.crunchbase.com/organization/morelli,,"Automotive, Productivity Tools, Wholesale","Enfield, Enfield, United Kingdom","Morelli Group is a distributor of spray guns, consumables, equipment and workshop equipment.","1,239,632","Europe, Middle East, and Africa (EMEA)",EN1 1SJ,$10M to $50M,Active,1957-01-01,year,,,,,For Profit,https://morelli.co.uk,https://www.facebook.com/morelliandco/,https://www.linkedin.com/company/morelli-group/,hello@morelli.co.uk,+44 0333 222 9943,,,,,,,,,,,,,"Commerce and Shopping, Software, Transportation",,,251-500,,,,,,,,,,,,,,,,,,,,,,,,,,,,,,,,,,Private,,,,,,,,,,,,,-1.6,4,0,2,,Advertising; business
Nexman,https://www.crunchbase.com/organization/nexman,,"Industrial Automation, Robotics","Vecchiano, Toscana, Italy",Nexman aids to innovate the production process through the management and integration of communication between man and machine.,"1,240,983","European Union (EU), Europe, Middle East, and Africa (EMEA)",56019,,Active,2017-01-01,year,,,,,For Profit,https://www.nexman.it,https://www.facebook.com/nexman.it,https://www.linkedin.com/company/nexman/,info@nexman.it,+39 050 806 7809,"Nexman offers automatic handling systems for manufacturing companies. They design and create dashboards and reports based on machinery monitoring data. Their services include industrial automation, industrial analytics, collaborative robots, robot rental, doosan robotics, and more.",,,,,,,,,,,,"Hardware, Manufacturing, Science and Engineering, Software",1,Akib Rahman Eham,11-50,,,,,,,,,,,,,,,,,,,,,,,,,,,,,,,,,,Private,,,,,,,,,,,,,-0.1,9,0,0,,Machines and machine tools
Optipack GmbH,https://www.crunchbase.com/organization/optipack-gmbh,,"Food and Beverage, Manufacturing","Aretsried, Bayern, Germany",Optipack is a manufacturer of PS and PP cups for the food industry.,"1,282,125","European Union (EU), Europe, Middle East, and Africa (EMEA)",86850,$10M to $50M,Active,,,,,,,For Profit,https://www.optipack.de,,https://www.linkedin.com/company/optipack-gmbh,,49 8236 999 509,,,,,,,,,,,,,"Food and Beverage, Manufacturing",,,11-50,,,,,,,,,,,,,,,,,,,,,,,,,,,,,,,,,,Private,,,,,,,,,,,,,1.5,8,2,6,Conveying; Packing; Storing; Handling Thin Or Filamentary Material,"Paper, cardboard and goods made from these materials"
Falorni,https://www.crunchbase.com/organization/falorni,,"Logistics, Pharmaceutical, Supply Chain Management","Sesto Fiorentino, Toscana, Italy","Falorni is a pharmaceutical company that offers packaging, logistics, and distribution services.","1,286,692","European Union (EU), Europe, Middle East, and Africa (EMEA)",,,Active,1954-01-01,year,,,,,For Profit,https://www.falornipharma.com,,https://www.linkedin.com/company/falorni-srl,info@falornipharma.com,39 0554494302,,,,,,,,,,,,,"Health Care, Transportation",,,11-50,,,,,,,,,,,,,,,,,,,,,,,,,,,,,,,,,,Private,,,,,,,,,,,,,2.9,18,,,,
