Voiseed,https://www.crunchbase.com/organization/voiseed,,"Artificial Intelligence (AI), Information Technology, Machine Learning, Software","Milan, Lombardia, Italy",Voiseed is an Italian startup specializing in artificial intelligence applied to the world of synthetic speech.,"58,477","European Union (EU), Europe, Middle East, and Africa (EMEA)",20136,$1M to $10M,Active,2020-01-01,year,,,,,For Profit,https://www.voiseed.com,,https://www.linkedin.com/company/64966455,info@voiseed.com,,"Voiseed is an Italian startup specializing in artificial intelligence applied to the world of synthetic speech. Voiseed created a fast and scalable AI Dubbing Platform tailored for the Video Game industry: https://www.voiseed.com/revoice-it , and we are constantly building more features in order to address other verticals.",,,,,,,,,,,,"Artificial Intelligence (AI), Data and Analytics, Information Technology, Science and Engineering, Software",2,"Andrea Ballista, Luca Dell'Orto",11-50,5,Seed,2023-02-07,1000000,EUR,1073094,Seed,1000000,EUR,1073094,Seed,1500000,EUR,1639269,3600000,EUR,4075178,"European Innovation Council, SkyDeck Berkeley, LIFTT",3,3,,,,,,,,,,,,,,Private,,,,,,,,,,,,,0,1,,,,
FABA,https://www.crunchbase.com/organization/faba-5598,,"Audiobooks, Consumer Electronics, Consumer Goods, EBooks, Education, Podcast, Publishing, Toys","Treviso, Veneto, Italy",FABA is a startup dedicated to the development of products that stimulate children's imagination.,"59,565","European Union (EU), Europe, Middle East, and Africa (EMEA)",31050,,Active,2019-05-01,day,,,,,For Profit,https://www.myfaba.com/,https://www.facebook.com/fabaraccontastorie,https://www.linkedin.com/company/faba-il-tuo-raccontastorie/,info@myfaba.com,+390422447600,"FABA is an interactive platform designed for children whose audio content educates and entertains without the need for screens. FABA's objective is to become the reference brand in the edutainment market by promoting the union between smart toys and audio editorial content, dedicated to children ranging from 0 to 10 years old. FABA aims to be the first smart toy to enter a child's bedroom, and then accompany them as they grow. FABA is designed by the children of yesterday for the adults of tomorrow",,,,,,,,,,,,"Consumer Electronics, Consumer Goods, Content and Publishing, Education, Hardware, Media and Entertainment, Music and Audio",4,"Alessio Polo, Chiara Gava, Francesco Poloniato, Matteo Fabbrini",11-50,2,,2025-01-23,4500000,EUR,4686817,Venture - Series Unknown,4500000,EUR,4686817,Venture - Series Unknown,8200000,EUR,8457802,8200000,EUR,8457802,"CDP Venture Capital, Oltre Impact, Ad4Ventures",2,3,,,,,,,,,,,,,,Private,,,,,,,,,,,,,-1.6,10,0,3,,Scientific and electric apparatus and instruments
WePlayed,https://www.crunchbase.com/organization/weplayed,,"CMS, Sports, Video","Boston, Massachusetts, United States",WePlayed Sports' intelligent short-form video platform automatically converts full-length game film into ready-to-share highlights.,"59,844","Greater Boston Area, East Coast, New England",,$1M to $10M,Active,2018-01-01,year,,,,,For Profit,https://www.weplayed.com,https://www.facebook.com/weplayedinc,https://www.linkedin.com/company/weplayedsports,info@weplayed.com,440-623-5811,"WePlayed Sports' intelligent short-form video platform automatically converts full-length game film into ready-to-share highlights. Powered by pioneering technology, the WePlayed Sports platform is focused on providing a new, efficient way to make the most meaningful #moments in sports readily available to fans everywhere. By automatically converting the full-length game film into ready-to-share #moments, WePlayed empowers teams, leagues, and other sports-centric organizations to meet fans’ growing demand for short-form video. WePlayed has partnered with several industry leaders, including LEARFIELD, SIDEARM Sports, WMT, and the NCAA along with schools from the SEC, ACC, Big 12, Big East, Ivy League, Sun Belt, and NEWMAC conferences. WePlayed is helping these organizations increase fan engagement and showcase athletes through short-form videos.",,,,,,,,,,,,"Information Technology, Media and Entertainment, Software, Sports, Video",4,"Paul Zukauskas, Pete Martin, Rob Ciampa, Terry Denson",11-50,5,,2024-01-01,,,,Venture - Series Unknown,,,,Venture - Series Unknown,2120000,USD,2120000,2120000,USD,2120000,"Techstars, Bossa Invest, Correlation Ventures, Astel Ventures, Ryan Moore",1,7,,,,,,,,,,,,,,Private,,,,,,,,,,,,,-0.2,9,,,,
Evja,https://www.crunchbase.com/organization/evja,,"Agriculture, AgTech, Artificial Intelligence (AI), Big Data, Information Services, Internet, Software","Naples, Campania, Italy","Evja is revolutionizing agriculture by combining Artificial Intelligence, Internet of Things and Agronomic Models.","60,134","European Union (EU), Europe, Middle East, and Africa (EMEA)",80142,$1M to $10M,Active,2015-01-01,year,,,,,For Profit,https://www.evja.eu,https://www.facebook.com/evja.official,https://www.linkedin.com/company/evja,info@evja.eu,+390810063832,"Evja is an exciting and fast-evolving ecosystem, thriving with people with long run experience in fields ranging from electronic engineer, physics and agronomy all the way to precision farming, machine learning and international business development. Evja is revolutionizing agriculture by combining Artificial Intelligence, Internet of Things and Agronomic Models, helping farmers to optimize their crop cycle, obtaining a healthier produce and having less impact on the environment.",,,,,,,,,,,,"Agriculture and Farming, Artificial Intelligence (AI), Data and Analytics, Information Technology, Internet Services, Science and Engineering, Software",2,"Antonio Affinito, Davide Parisi",11-50,7,Seed,2024-06-11,,,,Non-equity Assistance,4200000,EUR,4439042,Seed,4285000,EUR,4533608,4285000,EUR,4533608,"CDP Venture Capital, EIT Food, StartLife, Agro Innovation Lab Gmbh, Sefea Impact",3,6,,,,,,,,,,,,,,Private,,,,,,,,,,,,,-0.4,6,3,0,Computing; Calculating,
Lipogems International,https://www.crunchbase.com/organization/lipogems-international,,"Biotechnology, Health Care","Milano, Lombardia, Italy",Lipogems' adipose tissue treatments can assist physicians and patients keep or restore their health.,"60,143","European Union (EU), Europe, Middle East, and Africa (EMEA)",20129,$1M to $10M,Active,2010-01-01,year,,,,,For Profit,https://www.lipogems.com,,https://www.linkedin.com/company/lipogems-international-spa/,,,"Lipogems offers adipose tissue solutions to physicians and patients in order to help them maintain or restore their lifestyles. It created and patented a disposable sterile device (CE Marked Class IIa) for close-circuit, single-step lipoaspirate processing. Lipogems is a company based in Milano, Italy.",,,,,,,,,,,,"Biotechnology, Health Care, Science and Engineering",,,1-10,2,Early Stage Venture,2022-12-23,12500000,EUR,13333774,Series A,12500000,EUR,13333774,Series A,14200000,EUR,15038934,14200000,EUR,15038934,"LIFTT, ABC Medtech",2,2,,,,,,,,,,,,,,Private,,,,,,,,,,,,,1.8,3,15,6,Medical Or Veterinary Science; Hygiene,"Pharmaceutical, veterinary and sanitary products"
Restorative Neurotechnologies,https://www.crunchbase.com/organization/restorative-neurotechnologies,,"Health Care, Medical Device, Neuroscience, Psychology, Wellness","Palermo, Sicilia, Italy",Restorative Neurotechnologies is focusing on the development of medical devices and innovative solutions for rehabilitation.,"60,762","European Union (EU), Europe, Middle East, and Africa (EMEA)",90143,$1M to $10M,Active,2018-01-01,year,,,,,For Profit,https://www.restorativeneurotechnologies.com,https://www.facebook.com/restorativeNT/,https://www.linkedin.com/company/restorative-neurotechnologies,,,Restorative Neurotechnologies is focusing on the development of medical devices and innovative solutions for rehabilitation and cognitive enhancement.,,,,,,,,,,,,"Biotechnology, Health Care, Science and Engineering",1,Agnese Di Garbo,11-50,2,Early Stage Venture,2024-11-05,3000000,EUR,3280205,Series A,3000000,EUR,3280205,Series A,4000000,EUR,4452545,4000000,EUR,4452545,"CDP Venture Capital, ENEA Tech e Biomedical, Italian Angels for Growth, Manilo Marocco Partners, SocialFare",2,5,,,,,,,,,,,,,,Private,,,,,,,,,,,,,2.4,3,1,0,Medical Or Veterinary Science; Hygiene,
Nuwa,https://www.crunchbase.com/organization/nuwa-innovation,,"Augmented Reality, Consumer Electronics, Hardware, Virtual Reality","Groningen, Groningen, The Netherlands",Nuwa Invents Spatial computing technology that can work and play in a world where the lines between screens and reality.,"61,354","European Union (EU), Europe, Middle East, and Africa (EMEA)",9723JA,$1M to $10M,Active,2020-01-01,year,,,,,For Profit,https://nuwapen.com,https://www.facebook.com/nuwapen,https://www.linkedin.com/company/nuwa-innovation,info@nuwainnovation.com,,Nuwa Pen is a smart pen that digitizes your handwriting on any paper. Launched during CES 2023. Shipping late 2024.,,,,,,,,,,,,"Consumer Electronics, Hardware, Software",,,11-50,4,Seed,2024-01-04,1500000,EUR,1642124,Seed,1500000,EUR,1642124,Seed,2500000,EUR,2708418,2885551,EUR,3153505,,,,,,,,,,,,,,,,,Private,,,,,,,,,,,,,-2.3,9,,,,
Lifeed,https://www.crunchbase.com/organization/lifeed,,"Corporate Training, EdTech, Human Resources","Milan, Lombardia, Italy",Lifeed (powered by Life Based Value) is a B2B soft skills training platform that transforms life transitions into professional growth.,"61,555","European Union (EU), Europe, Middle East, and Africa (EMEA)",,$1M to $10M,Active,2015-10-12,day,,,,,For Profit,https://lifeed.io/,https://www.facebook.com/maternityasamaster,https://www.linkedin.com/company/lifebasedvalue/,info@lifeed.io,,"Lifeed (powered by Life Based Value) is a digital learning platform that unlocks life’s learning potential, transforming employees’ life transitions into professional growth. Companies that adopt Lifeed have access to a set of training and communications resources, a hub for sharing experiences and a dashboard with updated data on employees’ experiences. By using a strength-based approach, the Life Based Learning method demonstrates how life events can be maximised to improve the corporate environment, empowering parents, caregivers and transitioners to fully engage and reveal their value within the company, reducing stress and helping them to excel in their careers. Since launching in 2015, Life Based Value has worked with over 80 firms and is being piloted in 23 countries and 218 cities across the USA, Europe, Southeast Asia and Australia. Over 20,000 people have participated and the results indicate that the program can improve soft skills by up to 35%.",,,,,,,,,,,,"Administrative Services, Education, Software",2,"Giuseppe Donagemma, Riccarda Zezza",11-50,5,Seed,2023-12-31,3500000,EUR,3863177,Convertible Note,850000,EUR,954413,Seed,1500000,EUR,1730991,5000000,EUR,5594168,"Opes Italia, iStarter, Growth Engine, Impact Ventures Hungary, Opes Impact Fund",2,10,,,,,,,,,,,,,,Private,,,,,,,,,,,,,0,10,,,,
Soul-K,https://www.crunchbase.com/organization/soul-k,,"Food and Beverage, Food Processing, Manufacturing","Milano, Lombardia, Italy",Food-tech scale-up that creates semi-prepared food ingredients and complete prepared meals for professionals in the HO.RE.CA & L.O.D. sector,"61,770","European Union (EU), Europe, Middle East, and Africa (EMEA)",,$1M to $10M,Active,2015-01-01,year,,,,,For Profit,https://www.soul-k.com,https://www.facebook.com/SoulKItalia/,https://www.linkedin.com/company/soul-k/,servizioclienti@soul-k.com,+39 0398969806,"Soul-K is a BtoB food-tech company that produces and delivers semifinished and finished goods that allow professionals to execute their food operations in a new and efficient way.  Our products: -ReadyToChef E2: line of semifinished food products and ingredients ready for your teams’ imagination.  -Switch: the first line of ready-to-eat meals on a subscription model for professionals.   -FitUp: our R&D department. We help you achieve the best product for your business. Scale your production capacity and maintain high quality standards.  Minimize waste, optimize your warehouse, reduce prep time and boost capacity.   We’ll help you make It. Soul-k.com welcome to the future of the food business.",,,,,,,,,,,,"Food and Beverage, Manufacturing",2,"Andrea Cova, Matteo Minardi",11-50,6,,2023-10-12,20500000,USD,20500000,Venture - Series Unknown,20500000,USD,20500000,Venture - Series Unknown,25239733,USD,25239733,25809858,USD,25809858,"CDP Venture Capital, Crédit Agricole, Innogest Capital, LIFTT, Azimut Libera Impresa",3,13,,,,,,,,,,,,,,Private,,,,,,,,,,,,,-0.2,9,,,,
Smartway,https://www.crunchbase.com/organization/smartway-c69c,,"B2B, Enterprise, Packaging Services","Xian Shi, Shaanxi, China","Smartway is a high-tech enterprise that focuses on R&D, production & sales of organic light-emitting materials & packaging materials.","62,292",Asia-Pacific (APAC),,,Active,2017-01-01,year,,,,,For Profit,,,,,,"Smartway is a high-tech enterprise that focuses on research and development, production & sales of flexible organic light-emitting materials & packaging materials.",,,,,,,,,,,,"Administrative Services, Other",,,,3,,2025-04-21,50000000,CNY,6856453,Venture - Series Unknown,50000000,CNY,6856453,Venture - Series Unknown,150000000,CNY,20594415,150000000,CNY,20594415,"Chuxin Capital, Winreal Investment, Bridge Capital China, Xian Manareco New Materials, Yizhan Capital",3,6,,,,,,,,,,,,,,Private,,,,,,,,,,,,,5.6,1,,,,
Heuristik,https://www.crunchbase.com/organization/heuristik,,"Artificial Intelligence (AI), Biometrics, Health Care, Software","Bilbao, Pais Vasco, Spain",Heuristik is a software solution that helps healthcare entities identify and manage patients.,"62,452","European Union (EU), Europe, Middle East, and Africa (EMEA)",,,Active,2019-11-11,day,,,,,For Profit,http://www.heuristik.tech/,,https://www.linkedin.com/company/heuristik,info@heuristik.tech,,Heuristik is a software solution that helps healthcare entities identify and manage patients by combining fingerprint recognition and artificial intelligence. They help with process planning and the administrative management of patients through the use of statistical analysis and proprietary management algorithms.,,,,,,,,,,,,"Artificial Intelligence (AI), Biotechnology, Data and Analytics, Health Care, Science and Engineering, Software",1,Antxon Caballero,11-50,2,Seed,2022-02-11,325000,EUR,368907,Grant,62500,EUR,70377,Pre-Seed,62500,EUR,70377,387500,EUR,439284,,,,,,,,,,,,,,,,,Private,,,,,,,,,,,,,5,5,0,2,,Scientific and electric apparatus and instruments
EasyPol,https://www.crunchbase.com/organization/easypol,,"Apps, Financial Services, FinTech, Mobile Apps, Mobile Payments, Payments, Personal Finance","Roma, Lazio, Italy",Digital solution for fines and taxes payment and for personal financial management,"63,471","European Union (EU), Europe, Middle East, and Africa (EMEA)",00144,$1M to $10M,Active,2018-01-01,year,,,,,For Profit,https://easypol.io,https://www.facebook.com/easypol,https://www.linkedin.com/company/easypol,team@easypol.io,,"EasyPol allows you to connect multiple bank accounts, manage all your funds and pay online taxes, fines, and bills from one single app. With EasyPol you can save the receipts in a single digital archive via personalized folders, set reminders, and park vehicles in the Garage to see the tax status of all your vehicles.  You can connect bank accounts and credit cards, manage your subscriptions, make wire transfers, categorize your income and expenses so as to know your overall account balance and have the big picture on your financial situation.",,,,,,,,,,,,"Apps, Financial Services, Mobile, Payments, Software",3,"Gianluca Ventola, Matteo Preziotti, Mohamed Fadiga",11-50,6,Early Stage Venture,2021-08-02,1700000,EUR,2018602,Series A,1700000,EUR,2018602,Series A,2310000,EUR,2743124,2590000,EUR,3051414,CDP Venture Capital,1,1,,,,,,,,,,,,,,Private,,,,,,,,,,,,,2.4,14,,,,
Ekore,https://www.crunchbase.com/organization/ekore,,"Building Maintenance, Internet of Things","Milan, Lombardia, Italy",Ekore is a digital twin technology company that provides data-driven decision-making to enhance building and city management.,"64,147","European Union (EU), Europe, Middle East, and Africa (EMEA)",20154,,Active,2022-01-01,year,,,,,For Profit,https://www.ekore.it,,https://www.linkedin.com/company/ekore-digital-twin-solution,info@ekore.it,+39 351 6878539,Ekore is a digital twin technology company that provides data-driven decision-making to enhance building and city management.,,,,,,,,,,,,"Internet Services, Real Estate",1,Andrea Agostini,11-50,1,Seed,2024-12-18,1300000,EUR,1345513,Seed,1300000,EUR,1345513,Seed,1300000,EUR,1345513,1300000,EUR,1345513,"CDP Venture Capital, Nova Capital, Zest Investment, COIMA, HabiSmart",,6,,,,,,,,,,,,,,Private,,,,,,,,,,,,,1.7,,,,,
Mapo Tapo,https://www.crunchbase.com/organization/mapo-tapo,,"Information Services, Outdoors, Sports, Travel","Milan, Lombardia, Italy",A platform where certified guides can organize group trips for extreme sports enthusiasts,"64,258","European Union (EU), Europe, Middle East, and Africa (EMEA)",20123,Less than $1M,Active,2020-08-07,day,,,,,For Profit,https://www.mapotapo.com/,https://www.facebook.com/mapotapo/,https://www.linkedin.com/company/mapotapo,hello@mapotapo.com,+393922863637,"Mapo Tapo is the climbing travel platform, where users can plan and book authentic experiences off-the-beaten track, handled by local guides and hosts. Our mission is to develop extreme sport tourism in remote locations as a way to bring economic growth in a responsible manner, respecting the environment and making local communities thrive.",,,,,,,,,,,,"Information Technology, Sports, Travel and Tourism",2,"Alessia Fontanari, Daniele Calvo Pollino",1-10,2,Seed,2024-09-23,1150000,EUR,1277707,Seed,1150000,EUR,1277707,Seed,1505500,EUR,1680499,1505500,EUR,1680499,"Intesa Sanpaolo, B4i - Bocconi for innovation, Intesa Sanpaolo Innovation Center, Human Company, Business Angels",1,7,,,,,,,,,,,,,,Private,,,,,,,,,,,,,-0.2,8,0,1,,Scientific and electric apparatus and instruments
Sealence,https://www.crunchbase.com/organization/sealence,,"Industrial, Machinery Manufacturing, Manufacturing","Lucinasco, Liguria, Italy",Sealence is a developer of nautical propulsion systems for boats with electric outboard hydrojets.,"65,578","European Union (EU), Europe, Middle East, and Africa (EMEA)",20090,$1M to $10M,Active,2015-01-01,year,,,,,For Profit,https://www.sealence.it/?lang=en,https://www.facebook.com/deepspeedmotor/,https://www.linkedin.com/company/sealence-s-p-a-s-b/,info@deepspeed.it,,"Sealence concentrates on the creation of marine propulsion systems for electric outboard hydro-jets in boats. Customers in the boating industry can benefit from their product's reduced size and weight, outward installation capability, elimination of the requirement for mating, lack of noise and vibration, use of an electric engine, and creation of an optimal cooling system, among other features.",,,,,,,,,,,,Manufacturing,,,11-50,2,,2024-02-01,7556386,EUR,8217098,Equity Crowdfunding,7556386,EUR,8217098,Equity Crowdfunding,7556386,EUR,8217098,10056386,EUR,10943260,Azimut Direct,1,1,,,,,,,,,,,,,,Private,,,,,,,,,,,,,-1.9,11,1,0,,
WelMed,https://www.crunchbase.com/organization/welmed-0dab,,"Artificial Intelligence (AI), Big Data, Health Care, Medical, Online Portals, Software","Milano, Lombardia, Italy","WelMed is a digital platform that provides online medicine, clinical collaboration, digital solutions, and healthcare services.","66,844","European Union (EU), Europe, Middle East, and Africa (EMEA)",20129,,Active,2017-01-01,year,,,,,For Profit,https://www.welmed.it/,,https://www.linkedin.com/company/welmed-italia/,info@welmed.it,+39 02 31055823,"WelMed provides a web based platform that provides healthcare services. They also provide medical consultations, telephone communications, and video visits for patients. They offer secretariat management and radiological image management services for doctors.",,,,,,,,,,,,"Artificial Intelligence (AI), Data and Analytics, Health Care, Internet Services, Science and Engineering, Software",2,"Giulia Franchi, Marco Manzoni",11-50,2,,2021-10-15,5000000,EUR,5799852,Venture - Series Unknown,5000000,EUR,5799852,Venture - Series Unknown,10000000,EUR,11705703,10000000,EUR,11705703,"Digitech Venture Capital Fund, Alchimia Investments",1,2,,,,,,,,,,,,,,Private,,,,,,,,,,,,,-0.4,18,,,,
blinkoo,https://www.crunchbase.com/organization/blinkoo,,"Blockchain, Local, Social Media, Travel","Milano, Lombardia, Italy",A new Social Network based on short videos about local experiences.,"68,014","European Union (EU), Europe, Middle East, and Africa (EMEA)",20121,,Active,2021-10-27,day,,,,,For Profit,https://world.blinkoo.com/,https://www.facebook.com/blinkoo/,https://www.linkedin.com/company/blinkoo/,sme@blinkoo.com,+393883298893,"Hotels, restaurants, museums, shops, aperitifs, hikes, hidden gems. All the inspiration you need to unlock unique ways to spend your free time! A real community made up by hundred of thousends members. A place where you can share videos about tips, places and experiences that you truly love. We are a fast growing, young and innovative start up, that strongly believes in the power of multicultural exchange and inclusion.",,,,,,,,,,,,"Blockchain and Cryptocurrency, Internet Services, Media and Entertainment, Other, Sales and Marketing, Travel and Tourism",1,Smeraldo Meminaj,11-50,3,Seed,2022-06-13,1945000,EUR,2025750,Seed,1945000,EUR,2025750,Seed,3417000,EUR,3710453,3417000,EUR,3710453,,,,,,,,,,,,,,,,,Private,,,,,,,,,,,,,1.5,9,,,,
Sailogy,https://www.crunchbase.com/organization/sailogy,,"Leisure, Tourism, Travel","Chiasso, Ticino, Switzerland",Sailogy was born with the aim of making sailing holidays accessible to everyone.,"68,272","Europe, Middle East, and Africa (EMEA)",6830,$1M to $10M,Active,2012-01-01,year,,,,,For Profit,http://www.sailogy.com,https://www.facebook.com/sailogy,http://www.linkedin.com/company/sailogy,info@sailogy.com,+41 (0) 916820539,"Sailogy was born in 2013 with the aim of making sailing holidays accessible to everyone and providing them with the opportunity to rent a boat with comfort and safety. Customers all over the world can choose from a wide selection of sailing yachts, motor yachts, catamarans and gulets all rentable with or without experienced skippers and hostesses. Sailogy has become the market leader in three different countries – Italy, Germany and Switzerland – it’s the leading European charter agency with the widest range of boats with real-time availability, ready to be booked in just a few clicks. The company offers more than 22,000 boats in 800 destinations, from the Mediterranean to the Caribbean, and has over 100 thousand clients from 84 countries.",,,,,,,,,,,,"Community and Lifestyle, Travel and Tourism",1,Manlio Accardo,101-250,7,Early Stage Venture,2018-10-01,2000000,USD,2000000,Convertible Note,4500000,USD,4500000,Series A,8900000,USD,8900000,13900000,USD,13900000,"Credit Suisse, Rancilio Cube Sicaf, TiVentures, H-FARM, R-301 Capital",2,7,1,Made Acquisitions,,,,,,,,,,,,Private,,,,,,,,,,,,,-0.1,7,0,1,,Telecommunications
Wanted,https://www.crunchbase.com/organization/wanted,,"Marketplace, Recruiting","New York, New York, United States",An anonymous marketplace for talent to switch jobs at their desired salary,"68,548","Greater New York Area, East Coast, Northeastern US",,$10M to $50M,Closed,2019-01-01,year,,,2021-10-21,day,For Profit,https://getwanted.com/,https://www.facebook.com/wantedofficial/,https://www.linkedin.com/company/wanted-official,,,Wanted is an anonymous marketplace to switch jobs at your desired salary. Keep an eye on the job market while receiving committed job opportunities at your chosen salary. You will remain fully anonymous unless you agree to an interview.,,,,,,,,,,,,"Commerce and Shopping, Professional Services",6,"Balazs Alexa, Eva Peris, Fred Beasty, Guillaume Breux, Jean Meyer, Mario Eguiluz Alebicto",51-100,2,Seed,2020-02-01,2000000,USD,2000000,Pre-Seed,2000000,USD,2000000,Pre-Seed,2000000,USD,2000000,2000000,USD,2000000,"Frederic Halley, Ben Orthlieb, Jean-Sébastien Wallez",,3,,,,,,,,,,,,,,Private,,,,,,,,,,,,,-0.1,5,0,22,,Clothing; footwear; headgear
Macai,https://www.crunchbase.com/organization/macai,,"B2C, Delivery, E-Commerce, Food and Beverage, Food Delivery, Grocery, Internet, Retail Technology","Milan, Lombardia, Italy",Full Grocer in the Q-commerce space,"68,755","European Union (EU), Europe, Middle East, and Africa (EMEA)",20124,,Active,2021-04-01,month,,,,,For Profit,https://macaiapp.com/,,https://www.linkedin.com/company/macaiit/,,,"Macai offers thousands of high-quality products delivered at your doorstep in a few minutes. It is the first Italian player in the q-commerce space. Founded by Giovanni Cavallo, serial entrepreneur with a deep background in food delivery, the project is now live in several Italian cities, defining itself as a full grocer in the q-commerce space, a second generation player offering up to 7,500 SKUs delivered in 30 minutes.",,,,,,,,,,,,"Administrative Services, Commerce and Shopping, Food and Beverage, Hardware, Internet Services, Other, Software, Transportation",3,"Alessandro Lattao, Filippo Binci, Giovanni Cavallo",1-10,2,Seed,2021-11-24,3000000,USD,3000000,Pre-Seed,3000000,USD,3000000,Pre-Seed,3000000,USD,3000000,3000000,USD,3000000,"Plug and Play, Lumen Ventures, Proximity Capital, Cats.vc",1,4,,,,,,,,,,,,,,Private,,,,,,,,,,,,,-0.9,242,,,,
