Wenda,https://www.crunchbase.com/organization/wenda,,Software,"Castel Maggiore, Emilia-Romagna, Italy","Wenda is the only collaborative, all-in-one Platform to govern data connected to Food traceability starting from cold and hot chains.","121,664","European Union (EU), Europe, Middle East, and Africa (EMEA)",40013,Less than $1M,Active,2015-02-26,day,,,,,For Profit,https://wenda-it.com,https://www.facebook.com/wendasrl,https://www.linkedin.com/company/wenda-srl/,info@wenda-it.com,051 05 63 050,"Wenda is an innovative Italian startup supported by European investors. Founded in 2015, it aims to contribute to the construction of a safer and more sustainable Food system. Wenda is the only all-in-one collaborative Platform to govern Food traceability data from the cold and hot chain. Wenda is a collaborative Platform that automatically collects, analyzes and shares supply chain data, automatically integrating with existing measurement tools, data loggers and management, logistics and quality software available on the market and already in use in the customer company. In this way it provides decision support and statistics on temperature and traceability to each player in each specific supply chain. Wenda’s multi-disciplinary team has a long experience in technology, in the management of corporate clients and in agile innovation methods (IoT solutions). It has developed key partnerships with Universities and leading European companies. Wenda mission is to contribute to the reduction of the Food waste by leveraging on the power of digitalization of the Food supply chain. At the same time, the company aims to contribute to the development of safety and traceability in the food system. Wenda developed an user-friendly, ease-to use and versatile Platform which automatically collects, controls, manages and shares food distribution supply chain data, integrating with measurement tools, data loggers and software (management, logistics and quality). The Platform responds to the food distribution companies needs for reduction of time and costs for the optimization of their processes and necessity of control of risk points. Wenda products can be widespread at a global level. The innovativeness of its technology, international vocation and its scalable business model make its solution the best one in allowing to effectively pursue its mission. Below is a list of the different features of the Platform. -Data management and integrity analytics: You can gain visibility into traceability and temperature data by controlling the main risk points in the supply chain. With the simple and easy-to-use all-in- one Platform, you can enhance your decision making and service level, cutting costs, optimizing time and increasing profits. -Document digitization and data storage: you can import the documents of each shipment, storage or goods entry, reducing storage time, quickly retrieving information and documents, receiving alerts and operational actions, sharing data with employees. All this from a single integrated and easy to use Platform. -Universal IoT Platform: The full potential of the Internet of Things (IoT) can be exploited to integrate all data loggers and measuring instruments already in use in the customer company or available on the market and to make them communicate with each other. In this way you can save time and ensure continuity with the technologies already in use, welcoming future developments. -Horizontal process management: You can increase your supply chain collaboration by working across the company and strengthening your connection with customers and suppliers. Thanks to multi-site management and multi-access control, you can choose with whom to share data in real time, allowing access to logistics, quality and management departments. This data can also be shared directly with suppliers and customers. -Blockchain, Big Data and Machine learning: the use of blockchain has three major benefits: transparency (everyone can visualize the information recorded on the blockchain), decentralization (blockchain operates on a network), security (data and transactions on the blockchain are encrypted). All the data gathered in the Platform form a huge quantity of data (Big Data): this improve the quality of decisions operators can make on the basis of that data, An additional help comes from the Machine Learning algorithm integrated in the Platform: the machine “learns” the best and most efficient way to manage processes and builds more and more refined models which can help operators in making decisions. A key goal of the Platform is to provide end-to-end supply chain visibility. This is why the Platform is organized into modules, allowing the customer to choose the ones needed for operations: taken individually, the modules manage temperature and heat and cold chain traceability in well-defined supply chain processes; when used in combination, the modules provide full end-to-end visibility of supply chain processes, supporting key players in making effective decisions, rationalizing costs, increasing profits and enhancing service levels. Below is a review of the different modules of the Platform: Shipping Phase - SHIPMENT Module Control, manage and share cold and heat chain data and traceability of products shipped in direct or split trucks, full containers (FCL) or groupage (LCL). Share information with customers and employees through the Shipment Module. -Control and management from web app -Verification of the condition of goods in transit -Logistic performance control -Savings from delivery optimization -Integrated data loggers: real-time datalogger / USB datalogger, Sea freight, Ground freight, Air freight, location, temperature, humidity and other sensors Storage phase - STORAGE Module Control, manage and share temperature data and traceability of old generation cold rooms, refrigerated display cabinets, manholes or refrigerators or already controlled with telemetry, and provide information to employees with the Storage Module. -Control and management from web app and mobile app -Digitizing the control of stored products -Verification of refrigeration systems -Save time on HACCP checks and reports -Integrated data loggers: wi-fi real-time data loggers / Bluetooth probes or data loggers / other instruments already in use in the company Reception stage - INBOUND Module Verify the product for which you will be responsible by checking, managing and sharing the temperature data and HACCP checklists detected during the goods entry. Association with logistic information, manually or from the company ERP, and sharing information with suppliers and collaborators through the Inbound Module. -Control and management from web app and mobile app -Digitizing the verification of accepted products -Savings on HACCP checks and reporting -Classification of suppliers according to performance -Available data loggers: infrared thermometer / probes or Bluetooth data logger / other instruments already in use in the company Output phase - OUTBOUND Module The product sent carries the brand of the company: it is necessary to verify the third logistic parties that come to pick up the product, checking, managing and sharing the temperature data of the outgoing goods and the vehicles that pick it up. These must be associated with logistical information, manually or from the company ERP, and then share the information with suppliers and collaborators through the Outbound Module. -Control and management from web app and mobile app -Check the vehicles that collect your product -Save on HACCP checks and reports -Rank logistics by performance -Integrated data logger: infrared thermometer / Bluetooth / real time probes or those already in use in the company Delivery phase - DELIVERY Module Check, manage and share the temperature data of the goods delivered to the final consumer by ecommerce, cooking centres, ho.re.ca., showing the control you have over the products you offer, and share the information with your customers, logistics suppliers and collaborators through the Delivery Module. -Control and management from web app -Digitization of Proof Of Delivery and Delivery Temperature -Increased service level -Automatic last mile data acquisition -Available data loggers: infrared thermometer / probes or Bluetooth data logger / other instruments already in use in the company.",,,,,,,,,,,,Software,1,Antonio Catapano,11-50,3,,2021-01-21,575000,EUR,699520,Venture - Series Unknown,575000,EUR,699520,Venture - Series Unknown,575000,EUR,699520,675000,EUR,810113,"CDP Venture Capital, MassChallenge, Rockstart, Digital Magics, makanta GmbH",2,5,,,,,,,,,,,,,,Private,,,,,,,,,,,,,1.5,2,1,0,Computing; Calculating,
Calton,https://www.crunchbase.com/organization/reviewmonkey,,"CRM, Information Technology, Marketing, Software","Salerno, Campania, Italy",Calton provides a customer experience and review management solution.,"121,780","European Union (EU), Europe, Middle East, and Africa (EMEA)",,,Active,2020-12-01,day,,,,,For Profit,https://calton.io,https://www.facebook.com/Calton.io,https://www.linkedin.com/company/calton-io/,info@reviewmonkey.it,,Calton provides a customer experience and reviews management solutions. Its platform collects and analyzes feedback and reviews to boost customer experience,,,,,,,,,,,,"Information Technology, Sales and Marketing, Software",1,Dario Annunziata,1-10,3,Seed,2023-09-29,220000,EUR,232767,Seed,220000,EUR,232767,Seed,297767,USD,297767,297767,USD,297767,Startup Wise Guys,1,1,,,,,,,,,,,,,,Private,,,,,,,,,,,,,0,11,,,,
Nanomnia,https://www.crunchbase.com/organization/nanomnia,,"Agriculture, Biotechnology, Cosmetics, Life Science, Nanotechnology, Nutraceutical, Pharmaceutical","Verona, Veneto, Italy",Nanomnia is a nano-biotech startup company developing nanoparticle-based solutions for the delivery of specific active compounds.,"125,357","European Union (EU), Europe, Middle East, and Africa (EMEA)",37059,,Active,2017-02-06,day,,,,,For Profit,http://www.nanomnia.eu,https://www.facebook.com/NanomniaSrl/,https://www.linkedin.com/company/nanomnia-srl/,info@nanomnia.eu,+393200251162,"Nanomnia Srl is a nano-biotech innovative startup company founded in Feb 2017, and develops on-demand, tailor-made nanoparticle-based solutions for the delivery of specific active compounds. Nanomnia aims to identify precision biotechnologies in agriculture for a better pest management, combining innovative methods with environmental protection. Nanomnia produces organic, biodegradable and biocompatible nanoparticles, for encapsulation of active compounds, such as fertilizers, pesticides and herbicides, to be selectively vehicled in plants. Nanoparticles increase the efficiency of crop treatments, further reducing their volatilization and decreasing toxicity and environmental contamination in crops. Nanoparticles are developed by Nanomnia with different biodegradable and biocompatible polymers that do not cause any type of environmental contamination, and are stable during their storage. Thus agri-nanotechnology holds the promise of controlled release of agrochemicals and site targeted delivery of various macromolecules needed for improved plant resistance to disease, efﬁcient nutrient utilization and enhanced plant growth.  The efﬁcacy of nanoparticles can therefore be tested in terms of physiological and quality performance, and effects on plant under the genomic and metabolomic proﬁles, with ﬁnal reduction of environmental impact and economic costs.",,,,,,,,,,,,"Agriculture and Farming, Biotechnology, Consumer Goods, Health Care, Science and Engineering",3,"Marta Bonaconsa, Michele Bovi, Pietro Vaccari",1-10,2,,2019-09-01,400000,EUR,439619,Equity Crowdfunding,400000,EUR,439619,Equity Crowdfunding,400000,EUR,439619,400000,EUR,439619,The Startup Training,,1,,,,,,,,,,,,,,Private,,,,,,,,,,,,,-0.1,9,,,,
BlockDox,https://www.crunchbase.com/organization/blockdox,,"Apps, Mobile, Software","London, England, United Kingdom",BlockDox is a software platform and mobile application.,"125,424","Europe, Middle East, and Africa (EMEA)",E14 5AB,,Active,2015-01-01,day,,,,,For Profit,https://www.blockdox.com,https://www.facebook.com/block.dox,https://www.linkedin.com/company/blockdox/,info@blockdox.co.uk,+440800069818,"BlockDox is a software platform and mobile application. BlockDox is an award winning urban digital solutions company headquartered in London, but working globally. Their talented and experienced team of engineers & data scientists are passionate about solving the biggest problems facing the built environment and smart cities today.",,,,,,,,,,,,"Apps, Mobile, Software",1,Nicolas Shulman,1-10,2,,2021-01-22,392750,GBP,537345,Equity Crowdfunding,392750,GBP,537345,Equity Crowdfunding,392750,GBP,537345,392750,GBP,537345,"The Future Fund, Pitch@Palace",,2,,,,,,,,,,,,,,Private,,,,,,,,,,,,,-0.1,17,,,,
BlockInvest,https://www.crunchbase.com/organization/blockinvest-bd36,,"Asset Management, Blockchain, Cryptocurrency, Financial Services","Milano, Lombardia, Italy",BlockInvest is a blockchain platform that supports financial institutions and market operators.,"125,801","European Union (EU), Europe, Middle East, and Africa (EMEA)",20123,$1M to $10M,Active,2019-01-01,year,,,,,For Profit,https://www.blockinvest.it/,,https://www.linkedin.com/company/realhouse/,,,"BlockInvest is a blockchain based financial services platform. BlockInvest platform delivers solutions for creating transparent and secure digital securities. They provide an investor base, optimize the sale processes, and reduce information asymmetries among market participants.",,,,,,,,,,,,"Blockchain and Cryptocurrency, Financial Services, Other, Payments, Software",7,"Alfredo Cesare Malgrati, Davide Baldi, Fabio Pacchioni, Fabrizio Ciciani, Lorenzo Rigatti, Massimo Calogiuri, Rossano Petrucci",1-10,3,,2024-05-10,,,,Venture - Series Unknown,,,,Venture - Series Unknown,50000,EUR,56095,50000,EUR,56095,"Crédit Agricole Italia, Enrico Rubboli, Open Venture",1,3,,,,,,,,,,,,,,Private,,,,,,,,,,,,,-0.6,12,,,,
Blimp,https://www.crunchbase.com/organization/blimp-s-r-l,,"Events, Internet, Software, Software Engineering","Milano, Lombardia, Italy","Blimp collects real-time data on people and vehicles flows in the physical world, either outdoor or indoor.","125,934","European Union (EU), Europe, Middle East, and Africa (EMEA)",,Less than $1M,Active,2017-10-26,day,,,,,For Profit,http://blimp.ai/,,https://www.linkedin.com/company/blimp-s-r-l/,info@blimp.ai,,"Blimp has developed the Head-Counter device to collect real-time data on people and vehicles flows in the physical world, either outdoor or indoor. Blimp Head-Counter processes sampled images in real-time to extract the audience volume and sociodemographic distribution (gender, age and emotional state) up to a 60 meters range in the standard version. The proprietary technology is privacy compliant as the image processing is executed directly on the device, transmitting only the aggregated and anonymized data to the cloud.",,,,,,,,,,,,"Events, Internet Services, Media and Entertainment, Science and Engineering, Software",1,Alex Buzzetti,11-50,3,,2019-12-28,711000,EUR,794521,Convertible Note,350000,EUR,391771,Equity Crowdfunding,1180000,EUR,1426635,1891000,EUR,2221156,e-Novia,1,1,,,,,,,,,,,,,,Private,,,,,,,,,,,,,-0.5,2,2,0,Computing; Calculating,
Omnienergy,https://www.crunchbase.com/organization/omnienergy-ee00,,"Artificial Intelligence (AI), Energy, Generative AI, Renewable Energy, Sustainability, Trading Platform","Rome, Lazio, Italy","Omnienergy develops artificial intelligence products to make the energy market more efficient, sustainable, and profitable.","126,324","European Union (EU), Europe, Middle East, and Africa (EMEA)",,,Active,2019-11-29,day,,,,,For Profit,https://omni-energy.it,https://www.facebook.com/omnienergyAI,https://www.linkedin.com/company/omnienergyai,info@omni-energy.it,,"Omnienergy develops artificial intelligence products to make the energy market more efficient, sustainable, and profitable. Our mission is to revolutionize energy prediction, to accelerate energy transition. Our first product, Orchestra, forecasts the energy produced by solar and wind power plants up to the 48-hour time horizon. Its main application is in the Short-term Spot Power Markets - Intraday Market and Day-Ahead Market, with performances up to 50% better than competitors.",,,,,,,,,,,,"Artificial Intelligence (AI), Data and Analytics, Energy, Financial Services, Lending and Investments, Science and Engineering, Software, Sustainability",1,Andrea Moretti,1-10,2,Seed,2020-02-01,728000,EUR,807665,Debt Financing,255000,EUR,280969,Pre-Seed,255000,EUR,280969,983000,EUR,1088634,,,,,,,,,,,,,,,,,Private,,,,,,,,,,,,,0.3,,,,,
Hercle,https://www.crunchbase.com/organization/hercle-financial,,"Cryptocurrency, Financial Services, FinTech","Milano, Lombardia, Italy",Hercle is a digital assets market maker and broker dealer,"129,783","European Union (EU), Europe, Middle East, and Africa (EMEA)",,Less than $1M,Active,2019-01-01,year,,,,,For Profit,https://hercle.financial/,,,,,Hercle is a FinTech company that develops low-latency technology that offers end-to-end prime-brokerage solutions and trading algorithms to institutional investors who are interested in gaining exposure to crypto-assets.,,,,,,,,,,,,"Blockchain and Cryptocurrency, Financial Services, Payments, Software",,,11-50,3,Seed,2023-05-23,1700,EUR,1831,Seed,1700,EUR,1831,Seed,1700,EUR,1831,1700,EUR,1831,"Tenity, PranaVentures, Kairos Partners, Banca Sella Holding, Business Angels",2,5,,,,,,,,,,,,,,Private,,,,,,,,,,,,,0.2,7,,,,
Buzzup,https://www.crunchbase.com/organization/buzzup-7a25,,"Apps, Social Media, Software, Video Streaming","Los Angeles, California, United States",Home for the Creator Generation - merit-based video-sharing platform built for a community of creators.,"130,557","Greater Los Angeles Area, West Coast, Western US",90670,,Active,2021-07-01,day,,,,,For Profit,https://buzzup.co,,https://www.linkedin.com/company/buzzup-co,info@buzzup.co,,"Merit-based social platform that enables creators to gamify access to exclusive content, interactions, and experiences.",,,,,,,,,,,,"Apps, Content and Publishing, Internet Services, Media and Entertainment, Software, Video",1,Jay Cheng,1-10,1,Seed,2021-06-01,500000,USD,500000,Pre-Seed,500000,USD,500000,Pre-Seed,500000,USD,500000,500000,USD,500000,,,,,,,,,,,,,,,,,Private,,,,,,,,,,,,,2.6,3,,,,
Elephants,https://www.crunchbase.com/organization/elephants-91e3,,"Collectibles, Fashion, Jewelry","Manno, Ticino, Switzerland",Elephants is a global community-driven platform that allows to purchase and own the most iconic watches on the market.,"130,751","Europe, Middle East, and Africa (EMEA)",6928,,Active,2022-01-01,year,2024-05-17,day,,,For Profit,https://www.elephantsclub.io/,https://www.facebook.com/ElephantsClub.io,https://www.linkedin.com/company/elephantsclub,info@elephantsclub.io,,"Elephants is a global community-driven platform that aims to democratize the 90 billion € luxury watch market by fractionalising real-world highly collectible timepieces. Buy fractions starting from 1,000€. Due to its non-divisibility and high cost of entry barrier, this asset class is still in the hands of less than 1% of the population, despite being an excellent method of diversification and having high historical appreciation.",,,,,,,,,,,,"Clothing and Apparel, Commerce and Shopping, Consumer Goods, Design",1,Gianvito Grasso,1-10,1,M&A,2023-06-22,500000,CHF,558659,Pre-Seed,500000,CHF,558659,Pre-Seed,500000,CHF,558659,500000,CHF,558659,,,,,Was Acquired,Elephants acquired by Splint Invest,https://www.crunchbase.com/acquisition/mark-investment-holding-ag-acquires-elephants-91e3--d2599ca9,Splint Invest,https://www.crunchbase.com/organization/mark-investment-holding-ag,2024-05-17,day,,,,Acquisition,,Private,,,,,,,,,,,,,-0.3,,,,,
Drinkme,https://www.crunchbase.com/organization/drinkme-575c,,"Delivery, E-Commerce, Food and Beverage, Wine And Spirits","Busto Arsizio, Lombardia, Italy",Drinkme is a wine and spirits supplier.,"131,229","European Union (EU), Europe, Middle East, and Africa (EMEA)",21052,,Active,2021-05-11,day,,,,,For Profit,https://www.drinkme.cloud,https://www.facebook.com/realdrinkme,https://www.linkedin.com/company/drinkme,info@drinkme.cloud,+39 0332 1810317,"Drinkme operates as a distributor and virtual warehouse. Their products include wine, spirits, non-alcoholic drinks, beers, ice, cock tail kit, bar equipment, and more. They sell their products to hotels, restaurants, bars, and individuals.",,,,,,,,,,,,"Administrative Services, Commerce and Shopping, Food and Beverage",5,"Andrea Marcella, Debora Frascoli, Fabio Brusa Pasque’, Luca Brusa, Tommaso Petrolo",1-10,2,,2024-04-22,578713,EUR,616615,Equity Crowdfunding,578713,EUR,616615,Equity Crowdfunding,858713,EUR,902504,858713,EUR,902504,,,,,,,,,,,,,,,,,Private,,,,,,,,,,,,,-0.1,10,,,,
Dresso,https://www.crunchbase.com/organization/dresso,,,"Florence, Toscana, Italy",The fashion platform designed to connect people and promote the circular economy,"131,700","European Union (EU), Europe, Middle East, and Africa (EMEA)",50124,Less than $1M,Active,2021-01-01,month,,,,,For Profit,https://dresso.com,,https://www.linkedin.com/company/dresso/about/,info@dresso.com,,"Dresso is the place where everyone can express themselves and share their unique style with our fashion community.  We aim to connect and inspire people, transforming the circular economy into a social experience.  Everyone can share their outfits and interact with the community, explore other people's wardrobes, and send offers to buy the products they love. On Dresso every item is associated with a digital identity certified on the blockchain. This technology ensures their authenticity and keeps track of the entire life cycle. Our mission is to build a community aware of the impact their wardrobes and shopping choices have on our planet.",,,,,,,,,,,,,3,"Albano Scavo, Enrico Pietrelli, Matteo Tugliani",1-10,1,Seed,2021-04-08,500000,EUR,595775,Pre-Seed,500000,EUR,595775,Pre-Seed,500000,EUR,595775,500000,EUR,595775,,,,,,,,,,,,,,,,,Private,,,,,,,,,,,,,2.9,1,1,4,Computing; Calculating,Scientific and electric apparatus and instruments
MICROTECH,https://www.crunchbase.com/organization/microtech-bb4e,,"Consulting, Medical Device, Technical Support","Sant'agata Di Militello, Sicilia, Italy",Microtech is a services company that provides technical assistance on electromedical equipment.,"136,371","European Union (EU), Europe, Middle East, and Africa (EMEA)",95030,Less than $1M,Active,1998-01-01,year,,,,,For Profit,https://www.microtechsrl.it/,https://www.facebook.com/microtechsrl,,info@microtechsrl.it,+39 095 725 3014,"Microtech provides technical support for electro-medical equipment used in public and private healthcare organizations. Their services include preventive maintenance,corrective maintenance,electrical safety,creation and assistance,and  testing. They created QMS and meticulously inspected every component of it.",,,,,,,,,,,,"Health Care, Information Technology, Other, Professional Services",,,51-100,1,,2023-02-22,2800000,EUR,2969512,Equity Crowdfunding,2800000,EUR,2969512,Equity Crowdfunding,2800000,EUR,2969512,2800000,EUR,2969512,"Azimut Holding, Annthillia Capital Partners",2,2,,,,,,,,,,,,,,Private,,,,,,,,,,,,,-0.3,10,0,8,,Scientific and electric apparatus and instruments
Jojolly,https://www.crunchbase.com/organization/jojolly,,"Apps, Food and Beverage","Rozzano, Lombardia, Italy",Jojolly enables employers to find a suitable staff within a short time.,"136,548","European Union (EU), Europe, Middle East, and Africa (EMEA)",20089,Less than $1M,Active,2019-04-15,day,,,,,For Profit,https://www.jojolly.it/,https://www.facebook.com/JoJollyapp,https://www.linkedin.com/company/jojolly/,info@jojolly.it,,"Jojolly provides job consulting services. They offer job search and human resource management in the catering sector with the guarantee of service, facilitating all bureaucratic aspects.",,,,,,,,,,,,"Apps, Food and Beverage, Software",2,"Davide Drammis, Mattia Ferretti De Luca",11-50,3,Seed,2021-11-30,350000,EUR,396551,Seed,350000,EUR,396551,Seed,562500,EUR,645955,562500,EUR,645955,"Fondazione Social Venture Giordano dell'Amore, a|impact, SocialFare",1,3,,,,,,,,,,,,,,Private,,,,,,,,,,,,,-0.2,8,,,,
Automyo,https://www.crunchbase.com/organization/automyo,,"Information Technology, SaaS, Service Industry, Software","Roma, Lazio, Italy","SaaS for the automation of business processes, based on RPA/IPA technologies.","136,950","European Union (EU), Europe, Middle East, and Africa (EMEA)",,,Active,2020-02-04,day,,,,,For Profit,https://automyo.com,https://www.facebook.com/automyotech,https://linkedin.com/company/automyo,info@automyo.com,,"Automyo developed Claudio, Italian SaaS for the automation of business processes based on RPA/IPA technologies. Claudio is a SaaS that allows, in an easy and fast way, to create automatic workflows between different business applications. Moreover, the ability to customize these flows, without having to know programming languages, allows the various professionals in the companies to speed up their work and reduce the percentage of errors.",,,,,,,,,,,,"Information Technology, Other, Software",2,"Andrea Iannello, Luca Adamo",1-10,2,Seed,2022-07-01,160000,EUR,166866,Pre-Seed,160000,EUR,166866,Pre-Seed,240000,EUR,263913,240000,EUR,263913,,,,,,,,,,,,,,,,,Private,,,,,,,,,,,,,1.9,3,,,,
