Tutoring,https://www.crunchbase.com/organization/tutoring-f021,,"Apps, E-Learning, Education","Yeoksamdong, Seoul-t'ukpyolsi, South Korea",Tutoring is an on-demand mLearning Platform.,"764,145",Asia-Pacific (APAC),,$1M to $10M,Active,2016-02-19,day,2018-08-08,day,,,For Profit,https://tutoring.co.kr,,https://www.linkedin.com/company/tutoringcorp,help@tutoring.co.kr,,Tutoring is an on-demand mLearning Platform.,,,,,,,,,,,,"Apps, Education, Software",,,11-50,3,M&A,2019-02-15,,,,Series A,,,,Series A,,,,,,,"Premier Partners, SparkLabs Accelerator, DSC Investment, KB Investment, Big Basin Capital",1,7,,Was Acquired,Tutoring acquired by Market Designers,https://www.crunchbase.com/acquisition/market-designers-acquires-tutoring-f021--92a3e6f6,Market Designers,https://www.crunchbase.com/organization/market-designers,2018-08-08,day,,,,Merger,,Private,,,,,,,,,,,,,-1.2,6,,,,
ifind,https://www.crunchbase.com/organization/ifind-platform,,"Construction, Consulting, Home Services, Hotel, Small and Medium Businesses","Campinas, Goias, Brazil","O ifind é um portal de serviços que conecta clientes a profissionais qualificados, facilitando contratações rápidas e seguras.","765,638",Latin America,,,Active,,,,,,,For Profit,http://www.ifind.com.br,https://www.facebook.com/profile.php?id=61559284854626,https://www.linkedin.com/company/ifindbrasil/,,,"No ifind, a confiança é construída através das avaliações. Contrate com base em feedbacks reais de outros clientes e compartilhe sua experiência também! Juntos, criamos uma comunidade de serviços mais transparente. Ifind Platform is based in São Paulo.",,,,,,,,,,,,"Other, Professional Services, Real Estate, Travel and Tourism",,,1-10,,,,,,,,,,,,,,,,,,,,,,,,,,,,,,,,,,Private,,,,,,,,,,,,,-0.2,,,,,
Orteat,https://www.crunchbase.com/organization/orteat,,"Food and Beverage, Organic, Organic Food","Milan, Lombardia, Italy",Orteat is an organic fruit and veg delivery service. It combines the ancient knowledge of agriculture and modern innovations of technology.,"771,226","European Union (EU), Europe, Middle East, and Africa (EMEA)",20100,,Active,2019-01-01,year,,,,,For Profit,https://www.orteat.com,https://www.facebook.com/Orteatcom/,https://www.linkedin.com/company/orteat/,info@orteat.com,+39  392 2012933 .,"Orteat is an organic fruit and veg delivery service. It combines the ancient knowledge of agriculture and the modern innovations of technology. Its platform allows farmers to sell directly to consumers and retailers. They build a sustainable food system through organic products, reduce food waste, and helping our farmers to get more value from their work.",,,,,,,,,,,,"Food and Beverage, Sustainability",,,1-10,,,,,,,,,,,,,,,,,,,,,,,,,,,,,,,,,,Private,,,,,,,,,,,,,7.8,3,,,,
Pascol,https://www.crunchbase.com/organization/pascol,,"B2B, Food and Beverage, Marketing, Shipping","Sorrento, Campania, Italy",Pascol is a supplier of beef.,"781,129","European Union (EU), Europe, Middle East, and Africa (EMEA)",80065,$1M to $10M,Active,2019-01-01,year,,,,,For Profit,https://pascol.it,https://www.facebook.com/Pascol-102557208398584,https://www.linkedin.com/company/pascol,info@pascol.it,+39 3714741035,"Pascol offers anyone the opportunity to purchase meat from cattle reared with extensive and semi-extensive methods. They work with care and respect for the territory, supporting them through the creation of synergies, paying them adequately, and advice to all affiliated breeders.",,,,,,,,,,,,"Food and Beverage, Other, Sales and Marketing, Transportation",1,Federico Romeri,11-50,,,,,,,,,,,,,,,,,,,,,,,,,,,,,,,,,,Private,,,,,,,,,,,,,-0.2,10,0,1,,Meats and prepared or preserved foods; dairy products
Cocobuk,https://www.crunchbase.com/organization/cocobuk,,"Online Portals, Software, Tourism","Bari, Puglia, Italy",Cocobuk is an online platform that provides online booking and advanced payment services for beaches.,"786,583","European Union (EU), Europe, Middle East, and Africa (EMEA)",,,Active,2017-01-01,year,,,,,For Profit,https://cocobuk.com,https://www.facebook.com/cocobukofficial,https://www.linkedin.com/company/coco-s-r-l,assistenza@cocobuk.com,39 80 880 7569,,,,,,,,,,,,,"Internet Services, Software, Travel and Tourism",2,"Antonio Baldassarre, Nicola Palumbo",11-50,,,,,,,,,,,,,,,,,,,,,,,,,,,,,,,,,,Private,,,,,,,,,,,,,0.9,10,0,1,,Scientific and electric apparatus and instruments
Aqua Farm,https://www.crunchbase.com/organization/aqua-farm,,"Agriculture, Farming, Organic Food","Torino, Piemonte, Italy",Aqua Farm is a synergy for sustainable agriculture that creates agri-food chains with a socio-economic impact.,"790,112","European Union (EU), Europe, Middle East, and Africa (EMEA)",,,Active,2022-01-01,year,,,,,For Profit,https://aqua-farm.it,https://www.facebook.com/AquaFarmSocietaBenefit,https://www.linkedin.com/company/aqua-farm-societ%C3%A0-benefit-startup-innovativa,info@aqua-farm.it,,"Aqua Farm technology of aquaponics is an eco-sustainable production system that combines hydroponic cultivation and fish farming; it is the perfect union between food and ornamental production models, which are integrated into a relationship of natural symbiosis, maximizing individual quality and advantages. The synergy between agriculture and fish farming represents an independent and self-sufficient circular economic model of production-transformation-sale, which allows them to create income and employment in a sustainable way.",,,,,,,,,,,,"Agriculture and Farming, Food and Beverage",,,1-10,,,,,,,,,,,,,,,,,,,,,,,,,,,,,,,,,,Private,,,,,,,,,,,,,2.9,7,,,,
Antsy Inc.,https://www.crunchbase.com/organization/antsy-inc,,Software,,"SaaS Appointment Scheduling, Queues, Omnichannel, Pagers, Graders QMS Software","794,046",,,,Active,2022-01-01,year,,,,,For Profit,https://www.antsy.app,,https://co.linkedin.com/company/antsy-inc?trk=public_profile_topcard-current-company,,,,,,,,,,,,,,,Software,4,"Andres Eusse, Juan Duque, Julian Cardona, Sebastian Berger",1-10,,,,,,,,,,,,,,,,,,,,,,,,,,,,,,,,,,Private,,,,,,,,,,,,,0.3,1,,,,
MIPU,https://www.crunchbase.com/organization/mipu,,"Analytics, Artificial Intelligence (AI), Business Development, Predictive Analytics","Salò, Lombardia, Italy",MIPU provides AI and predictive analysis solutions to optimize industrial processes and operations.,"795,912","European Union (EU), Europe, Middle East, and Africa (EMEA)",25087,,Active,2012-01-01,year,,,,,For Profit,https://mipu.it/,,https://www.linkedin.com/company/mipu-srl/,info@mipu.eu,0365 520098,"MIPU provides AI and predictive analysis solutions to optimize industrial processes and operations. The company offers a comprehensive portfolio of services, technologies, and trainings based on its competences related to energy efficiency, predictive maintenance, and reliability and predictive modelling. MIPU was founded in 2012 and is headquartered in Salò, Italy.",,,,,,,,,,,,"Artificial Intelligence (AI), Data and Analytics, Professional Services, Science and Engineering, Software",1,Giulia Baccarin,11-50,,,,,,,,,,,,,,,,,,,,,,,,,,,,,,,,,,Private,,,,,,,,,,,,,0,5,,,,
Real Bowl,https://www.crunchbase.com/organization/real-bowl,,"Food Delivery, Nutrition, Pet","Montagnana, Veneto, Italy",Real Bowl is a pet food manufacturing and distribution company.,"800,885","European Union (EU), Europe, Middle East, and Africa (EMEA)",35044,,Active,2020-01-01,year,,,,,For Profit,https://realbowl.it,https://www.facebook.com/myrealbowl,https://www.linkedin.com/company/real-bowl,info@realbowl.it,+39 327 986 1665,"Real Bowl is a pet food manufacturing and delivery company. They are the first that can be kept out of the fridge, true, healthy, free of preservatives, and customised for their furry friend's needs.",,,,,,,,,,,,"Community and Lifestyle, Food and Beverage, Health Care, Transportation",3,"Alberto Alfonso, Leonardo Colturato, Lorenzo Tecchio",11-50,,,,,,,,,,,,,,,,,,,,,,,,,,,,,,,,,,Private,,,,,,,,,,,,,2.6,12,,,,
Joggo,https://www.crunchbase.com/organization/joggo-a949,,"Internet, Recreation, Sports",,Joggo is a search engine for sports.,"801,452",,,,Active,2020-01-01,year,,,,,For Profit,https://joggo.com,https://www.facebook.com/joggofit,,media@joggo.com,+39 349 785 9070,"JOGGO is a sports center that compiles a comprehensive list of all sports facilities. They want to collect and make him, providing not only a large amount of meticulous and sectoral information, but also something more. Their technicians created cutting-edge management software that allows every type of sporting activity to have its own space, from the bowling green to the ski area, all the way up to multifunctional sports centers.",,,,,,,,,,,,"Internet Services, Sports",,,,,,,,,,,,,,,,,,,,,,,,,,,,,,,,,,,,,Private,,,,,,,,,,,,,4.5,11,,,,
Renow,https://www.crunchbase.com/organization/renow,,,,"Grow and make your business more sustainable with Renow’s AI-optimized recommerce platform for returns, trade-in and resell.","802,718",,,,Active,,,,,,,For Profit,https://renow.ai/,,,,,,,,,,,,,,,,,,,,,,,,,,,,,,,,,,,,,,,,,,,,,,,,,,,,,,Private,,,,,,,,,,,,,3.8,,,,,
FASTA,https://www.crunchbase.com/organization/fasta,,"Financial Services, Online Portals","Cape Town, NA - South Africa, South Africa","FASTA is an finance that offers instant online credit, digital lending, virtual card and secure payment solutions.","807,559","Europe, Middle East, and Africa (EMEA)",8001,,Active,2017-01-01,year,,,,,For Profit,https://www.fasta.co.za/,https://www.facebook.com/fastaonlinecredit/,https://www.linkedin.com/company/fasta-credit-at-checkout/,support@fasta.co.za,,,,,,,,,,,,,,"Financial Services, Internet Services",,,11-50,,,,,,,,,,,,,,,,,,,,,,,,,,,,,,,,,,Private,,,,,,,,,,,,,-0.2,2,,,,
Welfin,https://www.crunchbase.com/organization/welfin,,"Apps, Finance, FinTech","Milan, Lombardia, Italy",Welfin is a welfare system based on a sustainable finance model that revolutionizes employee credit.,"808,682","European Union (EU), Europe, Middle East, and Africa (EMEA)",20124,,Active,,,,,,,For Profit,https://welfin.it,,,info@welfin.it,,"Welfin offers advantageous, sustainable, and guaranteed solutions. They provide credit and optimize the valorisation of savings in order to create a positive social impact for people and communities, digital platform for P2P loans between employees with the guarantee of the company. The company's contact modes are by mail, phone, and physical address.",,,,,,,,,,,,"Apps, Financial Services, Software",,,,,,,,,,,,,,,,,,,,,,,,,,,,,,,,,,,,,Private,,,,,,,,,,,,,-0.6,9,,,,
èlevit,https://www.crunchbase.com/organization/èlevit,,"Advanced Materials, Hardware, Product Design, Robotics, Sensor","Bologna, Emilia-Romagna, Italy",Technology for Smart Surface,"809,853","European Union (EU), Europe, Middle East, and Africa (EMEA)",40132,,Active,2021-12-17,day,,,,,For Profit,,,https://www.linkedin.com/company/èlevit/,info@elevit-ui.com,,"èlevit pioneers Smart Surfaces by developing reliable touch sensors on materials like carbon fiber, glass, and ceramics. It closes the gap between mechanical buttons and touchscreens, starting with advanced HMIs in automotive and consumer products, and expanding into robotics and prosthetics.",,,,,,,,,,,,"Design, Hardware, Manufacturing, Science and Engineering, Software",1,Michele Aiello,,,,,,,,,,,,,,,,,,,,,,,,,,,,,,,,,,,Private,,,,,,,,,,,,,6.7,1,,,,
FGS,https://www.crunchbase.com/organization/fgs-inc,,"Manufacturing, Publishing","Aurora, Illinois, United States",FGS is a printing company that provides document creation and print services.,"816,329","Greater Chicago Area, Great Lakes, Midwestern US",,$10M to $50M,Active,1989-01-01,day,,,,,For Profit,http://fgraphic.com,https://b-m.facebook.com/FGS.fgraphic/,https://www.linkedin.com/company/fgs-inc./,,+1 617 389 0076,"FGS provides clients with services and solutions at a reasonable cost. It's a lot simpler to say than to do. It takes the proper culture, the FGS culture, to make it happen. Over 125 large organizations in the financial services, healthcare, and commercial industries rely on us for premedia, creative, print, fulfillment, compliance, technology, custom development, and managed services. They evolved into a full service direct communications company.",,,,,,,,,,,,"Content and Publishing, Manufacturing, Media and Entertainment",,,251-500,,,,,,,,,,,,,,,,,,,,,,,,,,,,,,,,,,Private,,,,,,,,,,,,,-1.2,4,,,,
Tesio Pharmaceuticals,https://www.crunchbase.com/organization/tesio-pharmaceuticals,,"Manufacturing, Pharmaceutical, Therapeutics","San Francisco, California, United States",Tesio Pharmaceuticals develops the next generation of anti-inflammatory products with Kinase Inhibition.,"817,436","San Francisco Bay Area, West Coast, Western US",,,Active,,,,,,,For Profit,https://www.tesiopharm.com,,https://www.linkedin.com/company/tesiopharm,,,"Tesio Pharmaceuticals is developing the next generation of anti-inflammatory products with Kinase Inhibition and state-of-the-art targeted drug delivery. Tesio was named after the Einstein of horse breeding, Frederico Tesio, who was the first person to apply Mendel’s Law of genetics to thoroughbred horse breeding.",,,,,,,,,,,,"Health Care, Manufacturing",,,1-10,,,,,,,,,,,,,,,,,,,,,,,,,,,,,,,,,,Private,,,,,,,,,,,,,6.9,,,,,
Holipay,https://www.crunchbase.com/organization/holipay-dd92,,"Internet, Tourism, Travel","Porto, Lisboa, Portugal","Holipay is a leading platform for accessing the best rates on flights and hotels, combined with cashback rewards.","818,302","European Union (EU), Europe, Middle East, and Africa (EMEA)",,,Active,,,,,,,For Profit,https://www.holipay.io/,,https://www.linkedin.com/company/holipay-io,hello@holipay.io,,"Holipay is a dynamic platform designed to help users find the lowest fares and prices for flights and hotels while earning cashback on their bookings. By redirecting users to trusted providers for completing their bookings, Holipay ensures users get the best deals and enjoy significant cashback rewards.",,,,,,,,,,,,"Internet Services, Travel and Tourism",,,1-10,,,,,,,,,,,,,,,,,,,,,,,,,,,,,,,,,,Private,,,,,,,,,,,,,-0.4,10,,,,
TTOP,https://www.crunchbase.com/organization/ttop,,"Biotechnology, Medical","Milan, Lombardia, Italy","TTOP is a modular, versatile, and user-friendly microphysiological platform.","821,413","European Union (EU), Europe, Middle East, and Africa (EMEA)",,,Active,,,,,,,For Profit,https://www.ttoptechnologies.com,,https://www.linkedin.com/company/ttop-true-tissue-on-platform/,info@ttoptechnologies.com,+39 346 104 6852,"TTOP provides preclinical prediction, guaranteeing more predictive results than conventional technologies, replicating complex human pathophysiological conditions and minimizing controversial animal use in research. For inquiries, telephone and contact numbers are used.",,,,,,,,,,,,"Biotechnology, Health Care, Science and Engineering",2,"Lorenzo Coppadoro, Maria Lombardi",1-10,,,,,,,,,,,,,,,,,,,,,,,,,,,,,,,,,,Private,,,,,,,,,,,,,5.2,2,,,,
Al.ta Cucina,https://www.crunchbase.com/organization/al-ta-cucina,,"Advertising, Communities, Food and Beverage, Media and Entertainment, Video","Rome, Lazio, Italy",Al.ta.Cucina is on the mission to create the world's largest community of Italian food lovers.,"825,452","European Union (EU), Europe, Middle East, and Africa (EMEA)",00193,,Active,2018-09-21,day,,,,,For Profit,https://altacucina.co/,https://facebook.com/altaticucina,https://www.linkedin.com/company/al-ta-cucina,simone@altacucina.co,,"We are creating the world's biggest community of Italian food lovers. Al.ta.Cucina is on the mission to create the world's largest community of Italian food lovers. We've started by simplifying the way Italian recipes are explained, with quick and easy videos that last around 1 minute each. So far, we've built a community of +3.5M people, obtained more than a billion video views and reached the highest engagement rate in the market, all 100% organically, without spending a dime in advertising. We are now creating a multi-channel brand, by expanding into different social media platforms and by creating our own & operated platform, which will simplify the way Italian recipes are explained and will encourage people to share their own recipes and cooking tips. Main KPIs: A community of +3.5 million Italian food lovers A monthly growth rate of +100k new fans +1 billion video views +20M people reached every month +400k uniques per month on our beta site",,,,,,,,,,,,"Advertising, Community and Lifestyle, Food and Beverage, Media and Entertainment, Sales and Marketing, Video",1,Simone Mascagni,1-10,1,Seed,2018-10-01,,,,Pre-Seed,,,,Pre-Seed,,,,,,,,,,,,,,,,,,,,,,,Private,,,,,,,,,,,,,-0.9,3,0,2,,Telecommunications
Podcastory,https://www.crunchbase.com/organization/podcastory,,"Advertising, Digital Entertainment, Podcast","Milan, Lombardia, Italy",Podcastory is a podcast factory.,"831,364","European Union (EU), Europe, Middle East, and Africa (EMEA)",20135,$1M to $10M,Active,2019-01-01,year,,,,,For Profit,https://podcastory.it,https://www.facebook.com/podcastory.it/,https://www.linkedin.com/company/podcastory/,info@podcastory.it,+39 02 9475 3246,Podcastory offers podcasts as the business unit that manages all marketing and communication activities aimed at the distribution and promotion of audio-native content.,,,,,,,,,,,,"Advertising, Media and Entertainment, Music and Audio, Sales and Marketing",1,Davide Schioppa,11-50,,,,,,,,,,,,,,,,,,,,,,,,,,,,,,,,,,Private,,,,,,,,,,,,,7.9,8,,,,
Truspace,https://www.crunchbase.com/organization/truspace,,"Building Material, Product Design, Real Estate","Edmonton, Alberta, Canada","Truspace designs and develops office interiors and engages in Commercial Renovation, Floor Plans, and Tenant Improvement Allowance.","833,358",,T6B 2R7,$1B to $10B,Active,2000-11-18,day,,,,,For Profit,http://www.truspace.ca,https://www.facebook.com/truspace-515281888653570,https://www.linkedin.com/company/truspace-design-build,info@truspace.ca,855.801.1156,,,,,,,,,,,,,"Design, Real Estate",,,11-50,,,,,,,,,,,,,,,,,,,,,,,,,,,,,,,,,,Private,,,,,,,,,,,,,5.1,3,,,,
NutriBees,https://www.crunchbase.com/organization/nutribees,,"Agriculture, Food and Beverage, Health Care, Hospitality, Travel","Milano, Lombardia, Italy",Healthy Food Personalized,"840,128","European Union (EU), Europe, Middle East, and Africa (EMEA)",20136,,Active,2017-05-20,day,2021-09-16,day,,,For Profit,https://www.nutribees.com/,https://www.facebook.com/nutribees,https://www.linkedin.com/company/11087041/,info@nutribees.com,,,,,,,,,,,,,,"Agriculture and Farming, Food and Beverage, Health Care, Travel and Tourism",1,Giovanni Menozzi,1-10,,M&A,,,,,,,,,,,,,,,,,,,,Was Acquired,NutriBees acquired by Eagle Capital Ventures,https://www.crunchbase.com/acquisition/eagle-capital-ventures-acquires-nutribees--a8b8f63c,Eagle Capital Ventures,https://www.crunchbase.com/organization/eagle-capital-ventures,2021-09-16,day,,,,Acquisition,,Private,,,,,,,,,,,,,-1.1,11,,,,
All About Water,https://www.crunchbase.com/organization/all-about-water,,"Janitorial Service, Service Industry","Chandler, Arizona, United States",All About Water provides water and plumbing services in the Phoenix metropolitan area.,"851,940","Greater Phoenix Area, Western US",85225,,Active,1974-01-01,year,2020-09-01,day,,,For Profit,https://www.ecowateraz.com/,https://www.facebook.com/ecowateraz,https://sg.linkedin.com/company/all-about-water-ecowater-systems,,480-470-0404,All About Water provides water and plumbing services in the Phoenix metropolitan area.,,,,,,,,,,,,"Other, Real Estate",,,11-50,,M&A,,,,,,,,,,,,,,,,,,,,Was Acquired,All About Water acquired by Wrench Group,https://www.crunchbase.com/acquisition/the-wrench-group-acquires-all-about-water--e14fb6f3,Wrench Group,https://www.crunchbase.com/organization/the-wrench-group,2020-09-01,day,,,,Acquisition,,Private,,,,,,,,,,,,,7,3,,,,
Cibuspay,https://www.crunchbase.com/organization/cibuspay,,"B2B, Financial Services, Internet, Payments","Bolzano, Friuli-Venezia Giulia, Italy",Cibuspay is a financial services company that offers a business meal payment system.,"856,154","European Union (EU), Europe, Middle East, and Africa (EMEA)",39100,Less than $1M,Active,2020-01-01,year,,,,,For Profit,https://cibuspay.it,https://www.facebook.com/cibuspay/,https://www.linkedin.com/company/cibuspayapp,cibuspay@pec.it,+39-389-161-3784,,,,,,,,,,,,,"Financial Services, Internet Services, Other, Payments",,,1-10,,,,,,,,,,,,,,,,,,,,,,,,,,,,,,,,,,Private,,,,,,,,,,,,,-0.1,18,,,,
Drowzee,https://www.crunchbase.com/organization/drowzee,,"Health Care, Home Health Care, Medical Device","Oslo, Oslo, Norway","Drowzee develops a scalable, drug-free, and personalized clinical treatment for people with chronic sleep deprivation.","860,620","Nordic Countries, Scandinavia, Europe, Middle East, and Africa (EMEA)",0160,Less than $1M,Active,2018-07-03,day,,,,,For Profit,https://drowzee.com/,,https://www.linkedin.com/company/drowzee/,hakon@drowzee.com,,Drowzee develops technology for remote healthcare monitoring and therapy.,,,,,,,,,,,,Health Care,3,"Eidan Tzdaka, Håkon Krogh, Rakesh GL",1-10,,,,,,,,,,,,,,,,,,,,,,,,,,,,,,,,,,Private,,,,,,,,,,,,,3.1,2,,,,
Popseekl,https://www.crunchbase.com/organization/popseekl,,"Art, E-Commerce, Fashion, Social Shopping","Milan, Lombardia, Italy",Social commerce platform,"872,738","European Union (EU), Europe, Middle East, and Africa (EMEA)",,,Active,2021-03-01,month,,,,,For Profit,https://popseekl.com/,,https://www.linkedin.com/company/popseekl,contact@popseekl.com,+393517914805,"Social commerce platfomr for the next generation of fashion, art and design creators",,,,,,,,,,,,"Clothing and Apparel, Commerce and Shopping, Design, Media and Entertainment",3,"Claudio Clemente, Giancarlo Scanagatta, Giovanni Labate",1-10,,,,,,,,,,,,,,,,,,,,,,,,,,,,,,,,,,Private,,,,,,,,,,,,,-0.4,11,,,,
Teethan,https://www.crunchbase.com/organization/teethan,,"Dental, Health Care, Medical, Medical Device","Garbagnate Milanese, Lombardia, Italy",TEETHAN is a dental care unit that has the first medical wireless device to measure the balance of dental occlusion and provide solutions.,"876,191","European Union (EU), Europe, Middle East, and Africa (EMEA)",20024,$1M to $10M,Active,2015-01-01,year,,,,,For Profit,https://teethan.com,https://www.facebook.com/teethanspa,https://www.linkedin.com/company/teethan-spa,info@teethan.com,+390299029694,,,,,,,,,,,,,Health Care,,,11-50,,,,,,,,,,,,,,,,,,,,,,,,,,,,,,,,,,Private,,,,,,,,,,,,,7.3,8,,,,
Samplesound,https://www.crunchbase.com/organization/samplesound,,"E-Commerce, Music Label, Retail","Avezzano, Abruzzi, Italy",Samplesound produces and sells record labels.,"885,468","European Union (EU), Europe, Middle East, and Africa (EMEA)",67051,,Active,,,,,,,For Profit,https://www.samplesoundmusic.com,https://www.facebook.com/samplesoundmusic/,,info@samplesoundmusic.com,,"Samplesound is an e-commerce firm that provides labels such as 3Q samples, aequor sound, audio strasse, audio sample, ashram sounds, banger samples, chop shop samples, deeperfect records, go deeva records sounds, godlike loops, and more.",,,,,,,,,,,,"Commerce and Shopping, Media and Entertainment, Music and Audio",,,,,,,,,,,,,,,,,,,,,,,,,,,,,,,,,,,,,Private,,,,,,,,,,,,,3.3,14,,,,
YK-Robotics,https://www.crunchbase.com/organization/yk-robotics,,"Developer Platform, Robotics, Software","Pontedera, Toscana, Italy","We are creating a platform to unleash all potential of automation creators, from system integrators to robotic cell users","891,290","European Union (EU), Europe, Middle East, and Africa (EMEA)",56025,,Active,2020-01-01,year,,,,,For Profit,https://www.yk-robotics.com/,,https://www.linkedin.com/company/yk-robotics/,info@yk-robotics.com,,"A platform to unleash all potential of automation creators, from system integrators to robotic cell users.  Our mission is to facilitate the usage of advanced robotic platforms in business of all sizes by providing robotic applications that can be configured, programmed and controlled in a more natural way. We support a wide variety of robotic arms, sensors, tools and algorithms executing all sorts of applications such as quality control, assembly, machine tending or packaging between many others.",,,,,,,,,,,,"Hardware, Science and Engineering, Software",2,"Joan Ortega Alcaide, Stefano Noferi",1-10,,,,,,,,,,,,,,,,,,,,,,,,,,,,,,,,,,Private,,,,,,,,,,,,,0.7,4,,,,
Dafne,https://www.crunchbase.com/organization/dafne,,"Consumer Goods, E-Commerce, Retail, Sex Industry, Wellness","Erba, Lombardia, Italy","Dafne provides vegan sexual wellness products, including natural lubricants, promoting a new concept of intimacy.","894,745","European Union (EU), Europe, Middle East, and Africa (EMEA)",22036,$10M to $50M,Active,2021-01-01,year,,,,,For Profit,https://www.dafnemia.com,,https://www.linkedin.com/company/dafnemia/,hello@dafnemia.com,,"Dafne offers vegan products for sexual wellness, designed to promote a new concept of intimacy. The company focuses on creating 100% made in Italy products that are suitable for everyone. Dafne's offerings include natural lubricants and other intimate care items, emphasizing respect for both the body and the planet. The company operates as a benefit corporation, reflecting its commitment to social and environmental responsibility.",,,,,,,,,,,,"Commerce and Shopping, Community and Lifestyle, Consumer Goods, Health Care",2,"Giacomo Cattaneo Giussani, Rodolfo Lironi",1-10,,,,,,,,,,,,,,,,,,,,,,,,,,,,,,,,,,Private,,,,,,,,,,,,,-1,12,,,,
